DIVINE MISSION SCHOOL,3430374,JHARKHAND,EAST SINGHBHUM,"VILL.-HITKU,PO-NARWA PAHAR,PS-SUNDERNAGAR,DIST-PURBI SINGHBHUM,JHARKHAND",832107,,"0657-2276561 ,",,,divinemissionschool1202@gmail.com,,2013,1/12/2013 12:00:00 AM,MRS. RINKU KUMARI SINGH,1,"M.A.,B.ED",03,07,Secondary School,Provisional,1/4/2018,31/3/2021,VIKAS BHARTI
JAMSHEDPUR PUBLIC SCHOOL,3430051,JHARKHAND,EAST SINGHBHUM,PANCHAVATI ROAD NEW BARIDIH JAMSHEDPUR JHARKHAND,831017,0657,"2285002 ,",2225900,,namiagar@gmail.com,,1988,,NAMITA AGARWAL,0,,,,Senior Secondary,Provisional,1/4/2014,31/ 3/ 2019,ALL INDIA WOMEN'S CONFERENCE
JAWAHAR NAVODAYA VIDYALAYA,3440015,JHARKHAND,EAST SINGHBHUM,"BALI KUDIA, PO CHOOTA PARULIA, DISTT EAST SINGHBHUM JHARKHAND",832101,6594,"252210 ,",233639,,dennison1803@gmail.com,,1993,4/1/1991 12:00:00 AM,Y DENNISON,0,,,,Senior Secondary,Provisional,1/4/2018,31/ 3/ 2023,NVS
Jusco School,3430275,JHARKHAND,EAST SINGHBHUM,"Dispensary Road, South Park , Bistupur, Distt East Singhbhum, Jharkhand",831001,0657,"2317365 ,",,0657-2424219,principal.jssp@jemfoundation.in,http://www.jemfoundation.in,2005,3/21/2005 12:00:00 AM,SHOVNA DE,2,M.A B.Ed,1,18,Senior Secondary,Provisional,1/4/2016,31/ 3/ 2019,JUSCO Education Mission Foundation
Jusco School,3430288,JHARKHAND,EAST SINGHBHUM,"Near Rankani Mandir, Road no -23 , Kadma",831005,0657,"6503045 ,",,0657 - 2424219,principal.jsk@jemfoundation.in,http://www.jemfoundation.in,2005,3/21/2005 12:00:00 AM,Jhumjhumi Nandi,0,M.A B.Ed,2,16,Senior Secondary,Provisional,1/4/2018,31/ 3/ 2021,JUSCO Education Mission Foundation
KASIDIH HIGH SCHOOL,3430143,JHARKHAND,EAST SINGHBHUM,SAKCHI PO SAKCHI JAMSHEDPUR JHARKHAND,831001,0657,"2428165 , 226723",,,principal.khs@jemfoundation.in,,1999,6/7/2010 12:00:00 AM,FRANCIS JOSEPH,0,,,,Senior Secondary,Provisional,1/4/2016,31/ 3/ 2017,SCHOLAR'S ACADEMY ALLAHABAD UP
KENDRIYA VIDYALAYA,3400026,JHARKHAND,EAST SINGHBHUM,SURDA GHATSILA EAST SINGHBHUM JHARKHAND,832303,6585,"265412 ,",04132655745,2655092,bishwanath.hansdah@yahoo.in,http://www.kv2raipur.org,1980,1/25/2009 12:00:00 AM,BISHWANATH HANSDAH,2,"M.Sc.Maths, B.Ed.",1,20,Senior Secondary,Provisional,1/4/2012,31/ 3/ 2017,KENDRIYA VIDYALAYA SANGATHAN
KERALA PUBLIC SCHOOL,3430201,JHARKHAND,EAST SINGHBHUM,BURMAMINES JAMSHEDPUR JHARKHAND,831007,0657,"2345629 ,",2341325,,hkaur1109@gmail.com,,1986,,Harwinder Kaur,1,"M.Sc.,B Ed",5,14,Secondary School,Provisional,1/4/2014,31/3/2019,KERALA PUBLIC SCHOOL TRUST
NETAJI SUBHAS PUBLIC SCHOOL,3430119,JHARKHAND,EAST SINGHBHUM,POKHARI BHILAI PAHARI PS MGM EAST SINGHBHUM JAMSHEDPUR JHARKHAND,831012,0657,"2210167 ,",2210494,,info@nspsjsr.com,,1996,5/3/2018 12:00:00 AM,S K MITRA,1,Msc Bed,10,15,Senior Secondary,Provisional,1/4/2018,31/ 3/ 2023,SITWANTO DEVI MAHIL KALYAN SANSTHAN
NETAJI SUBHAS PUBLIC SCHOOL,3430380,JHARKHAND,EAST SINGHBHUM,"Gangadihbera,PO-Haldipokhar, PS-KOWALI, Circle-Potka, Jamshedpur",831002,,"9386817857 ,",,06572210494,info@nsibm.com,http://www.nspshp.com,2015,4/1/2015 12:00:00 AM,MR. DEBADATTA GEORGE,1,MA BED,6,12,Secondary School,Provisional,1/4/2019,31/3/2022,OM SAI SHIKSHAN AND KALYAN SANSTHAN
NETAJI SUBHAS PUBLIC SCHOOL,3430323,JHARKHAND,EAST SINGHBHUM,,832106,0657,"3201100 ,",,06572233022,awadesharma@gmail.com,http://www.nspsjadugoda.com,2014,1/4/2014 12:00:00 AM,AWADHESH KUMAR SHARMA,1,MA BED,7,22,Senior Secondary,Provisional,1/4/2018,31/ 3/ 2021,Sitwanto Devi Mahila Kalyan Sansthan
NML Kerala Public School,3430293,JHARKHAND,EAST SINGHBHUM,"Bhuyadih, Agrico,",831009,0657,"2346211 ,",,-,gurmeetkaur2001@yahoo.com,http://www.keralapublicschools.com,2000,6/12/2000 12:00:00 AM,GURMEET KAUR,0,"MA,M.Ed",17,26,Secondary School,Provisional,1/4/2017,31/3/2022,Kerala Public Schools Trust
R.N. FOUNDATION LITTLE HEART SCHOOL,3430296,JHARKHAND,EAST SINGHBHUM,"Vill-KEDO,P.O.- NARWAPAHAR , P.S.-SUNDERNAGAR, JAMSHEDPUR,JHARKHAND ,PIN- 832111",832111,0657,"2318144 ,",,,chandrika.maity@yahoo.co.in,,2008,6/1/2008 12:00:00 AM,CHANDRIKA MAITY,0,"B.Com , B.Ed.",7,10,Secondary School,Provisional,1/4/2014,31/3/2017,RAMANAND FOUNDATION
RAMA KRISHNA MISSION SCHOOL,3430043,JHARKHAND,EAST SINGHBHUM,H F C SIDHGORA JAMSHEDPUR JHARKHAND,831009,0629,"21875 ,",5025,,dnp@fcis.bih.nic.in,,1977,,SH P C BHATTACHARYA,0,,,,Secondary School,Provisional,11/3/1988,3/3/1997,THE RAMAKRISHNA MISSION VIVEKANANDA
"RMS High School, Khutadih",3430345,JHARKHAND,EAST SINGHBHUM,"RMS High School, Khutadih, PO Sonari",831011,0657,"2308951 ,",,,shuklaparineeta@yahoo.in,,2001,1/16/2002 12:00:00 AM,PARINEETA SHUKLA,,"M.A., B.Ed., Ph.D.",9,15,Secondary School,Provisional,1/4/2017,31/3/2020,Rajasthan Maitri Sangh
S D S M SCHOOL FOR EXCELLENCE,3430149,JHARKHAND,EAST SINGHBHUM,DISPENDARY ROAD SIDHGORA PO AGRICO JAMSHEDPUR,831009,0657,"2211825 , 2212191",0657-2212279,2212190,moushumidas2009@gmail.com,,1996,6/30/2000 12:00:00 AM,MOUSHUMI DAS,2,"M.A., B.ED.",7,23,Senior Secondary,Provisional,1/4/2017,31/ 3/ 2022,S D S M EDU FOUNDATION
S E RLY MIXED HIGH SCHOOL,3480007,JHARKHAND,EAST SINGHBHUM,"TATA NAGAR, AT BAGBERA, DISTT EAST SINGHBHUM, JHARKHAND",831002,0657,"2292672 ,",2360613,,narsinghpradhan2011@gmail.com,,1983,4/1/2005 12:00:00 AM,NARSINGH PRADHAN,0,"M.A.(SANSKRIT, TELGU), B.Ed",,,Secondary School,Provisional,1/4/2016,31/3/2020,army welfare educataion society
S.D. PUBLIC SCHOOL,3430361,JHARKHAND,EAST SINGHBHUM,"BIRSA NAGAR (KHAKRIPARA), EAST SINGHBHUM, JHARKHAND-831009",831009,,"06572282783 ,",,,bijayshankar.ks@gmail.com,,2013,4/2/2013 12:00:00 AM,Mr.DHIRENDRA KUMAR DHIRAJ,,"M.Sc.,B.Ed",05,15,Secondary School,Provisional,4/1/2017,31/3/2020,S. D. SOCIAL DEVELOPMENT AND WELFARE SOCIETY
SANT NAND LAL SAMRITI VIDYA MANDIR,3430151,JHARKHAND,EAST SINGHBHUM,DAK BANGLOW ROAD PO GHATSHILA DISTT EAST SINGHBHUM JHARKHAND,832303,6585,"225534 ,",06585227672,0658522553,snsvmschool@gmail.com,,1983,7/1/2005 12:00:00 AM,SANJAY KUMAR MALLICK,2,"M.A,B.Ed.",18,20,Senior Secondary,Provisional,1/4/2018,31/ 3/ 2019,SHRI SATSANG SADAN
Shiksha Niketan,3430245,JHARKHAND,EAST SINGHBHUM,Shiksha Niketan TelcoP.O INDRANAGAR,831008,0657,"2286362 ,",,,sks.gem@gmail.com,,1968,2/1/1968 12:00:00 AM,SANJAY KUMAR SINGH,2,"MA-ENG MA ECO,B.ED",4,18,Senior Secondary,Provisional,1/4/2016,31/ 3/ 2021,Shiksha Prasar Kendra
south point school,3430302,JHARKHAND,EAST SINGHBHUM,"gobarghusi , patamda",832105,0657,"2652456 ,",,,message4madhu@gamil.com,,1996,2/15/1996 12:00:00 AM,MADHU MISHRA,0,"M.A , B.ED",05,15,Secondary School,Provisional,1/4/2014,31/3/2017,BIRBAL MAHARAJ TRUST
ST. MARY'S ENGLISH HIGH SCHOOL,3430057,JHARKHAND,EAST SINGHBHUM,KHARKAI LINK ROAD BISTUPUR JAMSHEDPUR JHARKHAND,831001,0657,"2320078 ,",421847,,PUTHUMAIJSR@GMAIL.COM,www.stmarysjamshedpur.in,1949,4/13/2007 12:00:00 AM,FR S PUTHUMAI RAJ,1,,,,Senior Secondary,Provisional,1/4/2018,31/ 3/ 2020,JAMSHEDPUR DIOCESE CORPOR.JAMSHEDP.
TARAPADA SARANGI DAV PUBLIC SCHOOL,3430255,JHARKHAND,EAST SINGHBHUM,"NH - 33, BAHARAGORA",832101,6594,"224988 ,",209059,--,tpsdavbhrgora@yahoo.in,,2005,5/2/2005 12:00:00 AM,SHASHI KANT PANDEY,1,"M. Sc., B. Ed.",08,20,Senior Secondary,Provisional,1/4/2016,31/ 3/ 2021,DAV College Trust & Management Society
VALLEY VIEW SCHOOL,3430110,JHARKHAND,EAST SINGHBHUM,ASHOK ROAD TRF NAGAR P.O TELCO JAMSHEDPUR JHARKHAND,831004,0657,"6410053 , 488838",,,vvsprincipal2014@gmail.com,,1989,4/2/2006 12:00:00 AM,ALKA ARVIND KUMAR,0,,,,Senior Secondary,Provisional,1/4/2017,31/ 3/ 2022,JAMSHEDPUR EDUCATION TRUST
VIDYA BHARATI CHINMAYA VIDYALAYA,3430015,JHARKHAND,EAST SINGHBHUM,NEAR P TYPE FLATS TELCO COLONY OPP. PLAZA DISPENSARY JAMSHEDPUR JHARKHAND,831004,0657,"2286965 ,",88050,,vbcvjsr@gmail.com,,1979,7/1/1986 12:00:00 AM,VIPIN SHARMA,2,"MA, BED",30,15,Senior Secondary,Provisional,1/4/2018,31/ 3/ 2023,CHINMAYA MISSION JAMSHED PUR
VIKAS VIDYALAYA 10+2,3430270,JHARKHAND,EAST SINGHBHUM,"Vikasnagar, R.no-15, jawaharnagar, goberhushi, jamshedpur",831018,0657,"2363028 ,",,,,,2003,12/3/2003 12:00:00 AM,VIKAS KUMAR,0,"M.sc.,B.ed.",4,1,Secondary School,Provisional,1/4/2015,31/3/2020,Vikas Bharti
vivek vidyalaya,3430153,JHARKHAND,EAST SINGHBHUM,chhata govindpur jamshedpur jharkhand,831015,0657,"6572679 ,",06572286758,,hussain8958@yahoo.co.in,,1983,4/3/2010 12:00:00 AM,IMTEYAZ HUSSAIN,1,"m.a,b.ed",05,12,Senior Secondary,Provisional,1/4/2015,31/ 3/ 2020,shiksha prasar kendra telco
XAVIER PUBLIC SCHOOL,3430331,JHARKHAND,EAST SINGHBHUM,"DORKASAI(BHALUKDIH),P.O.:-ASANBONI,P.S.:-JADUGORA , E.SINGHBHUM:-832102 , JHARKHAND",832102,0657,"917360079996 ,",,,xps.jsr@gmail.com,,2012,4/2/2012 12:00:00 AM,MRS.MEENASAHU,1,"M.SCI, B.ED",07,13,Senior Secondary,Provisional,1/4/2018,31/ 3/ 2021,SHIV EDUCATIONAL & WELFARE SOCIETY
BANSHIDHAR PARASNATH DAV PUBLIC SCHOOL,3430329,JHARKHAND,GARHWA,"B. P. DAV PUBLIC SCHOOL, PHARATHIA, GARHWA",822114,6561,"9431136772 ,",,,davpsgarhwa@gmail.com,,2009,7/1/2009 12:00:00 AM,AJAY KUMAR CHAUBEY,,"M. Sc., B. Ed.",7,18,Secondary School,Provisional,1/4/2016,31/3/2019,DAV COLLEGE MANAGING COMMITTEE
bnt st. mary's school,3430247,JHARKHAND,GARHWA,garhwa,822114,6561,"222278 ,",,,tiwaryamitabps@gmail.com,,2001,1/3/2001 12:00:00 AM,AMIT KUMAR TIWARY,0,"b.sc.,b.ed.",5,12,Secondary School,Provisional,1/4/2018,31/3/2023,baijnath tiwari memial trust
BOKARO ISPAT SR SEC SCHOOL,3430088,JHARKHAND,GARHWA,SECTOR IX E BOKARA STEEL CITY JHARKHAND,827009,6542,"296817 ,",,,sps.kd.2094@gmail.com,,1993,4/1/2002 12:00:00 AM,S P SINGH,2,,,,Senior Secondary,Provisional,1/4/2018,31/ 3/ 2023,BOKARAO ISPAT PLANT
D A V CENTENARY PUBLIC SCHOOL,3430072,JHARKHAND,GARHWA,BHAWANATHPUR TOWNSHIP DISTT. GARHWA JHARKHAND,822129,6563,"233637 ,",220,54561,drrksingh314@gmail,,1957,7/9/2003 12:00:00 AM,RAMESH KUMAR SINGH,1,"M.SC., B.ED.",7,7,Senior Secondary,Provisional,1/4/2017,31/ 3/ 2022,galaxian international school society
JAWAHAR NAVODAYA VIDYALAYA,3440014,JHARKHAND,GARHWA,ANNARAJ NAWADIH DISTT GARWHA JHARKHAND,822114,6561,"290531 ,",40231,,mr.cbpg@gmail.cpm,,1992,3/31/2011 12:00:00 AM,CHANDRA BHUSHAN PRASAD GUPTA,0,,,,Senior Secondary,Provisional,1/4/2017,31/ 3/ 2020,Navodaya Vidyalaya Samiti
KENDRIYA VIDYALAYA,3400030,JHARKHAND,GARHWA,"GARHWA, PIPRA KALA, GAYATRI NAGAR, GARHWA, JHARKHAND",829103,6561,"222336 ,",,,kvgarhwab64@gmail.com,,1998,,SANDHYA REKHA MINZ,0,,,,Secondary School,Provisional,1/4/2011,31/3/2014,KENDRIYA VIDYALAYA SANGATHAN
r k public school,3430164,JHARKHAND,GARHWA,sonpurwa at / po garhwa dist garhwa jharkhand,822114,6561,"290492 ,",222138,,principalrkpsgarhwa@gmail.com,,1997,,SHALIGRAM PANDEY,0,,,,Senior Secondary,Provisional,1/4/2014,31/ 3/ 2019,r k trust garhwa
R.K Public School,3430364,JHARKHAND,GARHWA,Unchari,822138,,"9431136058 ,",,,principalrkpsgarhwa@gmail.com,,2015,1/3/2015 12:00:00 AM,Mr.S.K.L Das,,M.A Bed.,10,20,Secondary School,Provisional,4/1/2017,31/3/2020,R.K Trust
saraswati shishu vidya mandir,3430207,JHARKHAND,GARHWA,bhavqnathpur nagri garhwa jharkhand,822129,6561,"9973688858 ,",,,ransumanbnpts@gmail.com,,,,Ran Suman Singh,0,,,,Secondary School,Provisional,1/4/2015,31/3/2020,bal kalayan samiti
BADRI NARAYAN SHAH DAV PUB SCH,3430102,JHARKHAND,GIRIDIH,BULAKI ROAD NEAR RAILWAY STATION GIRIDIH JHARKHAND,815201,6532,"222485 , 222485",223371,,bnsdavgiridih@hotmail.com,,1988,,PRABIR HAZRA,0,,,,Senior Secondary,Provisional,1/4/2014,31/ 3/ 2019,D A V COLLEGE & MANAGING COMMITTEE
D A V PUBLIC SCHOOL,3430074,JHARKHAND,GIRIDIH,CENTRAL COAL FIELDS LTD. GIRIDIH P.O. BANIADIH DISTT. GIRIDIH JHARKHAND,815311,6532,"222307 , 2462",06532222307,222307,davcclgrd@gmail.com,,1974,3/4/1996 12:00:00 AM,BHAIYA ABHINAV KUMAR,1,MSC. BED,12,18,Senior Secondary,Provisional,1/4/2015,31/ 3/ 2020,
DR. BHABHA PUBLIC SCHOOL,3430306,JHARKHAND,GIRIDIH,"AT: BARJO, P.O: RAJDHANWAR, DIST: GIRIDIH",825412,6554,"210020 ,",,,bhabhapublicschool@gmail.com,,2005,4/2/2005 12:00:00 AM,AJAY KUMAR CHOUDHARY,0,MA. B.ED.,5,7,Senior Secondary,Provisional,1/4/2017,31/ 3/ 2020,Dr. Bhahbha public high school sansthan
Holy Cross School,3430360,JHARKHAND,GIRIDIH,Holy Cross School Pachamba PO Giridih District,815316,6532,"226493 ,",,,srjancyhc@gmail.com,http://www.holycrossgiridih.in,2008,4/10/2008 12:00:00 AM,JANCYMOL MATHEW,,"M.Sc, B.Ed",6,14,Secondary School,Provisional,4/1/2017,31/3/2020,Maheshmunda Holy Cross Sisters Society
Honey Holy Trinity School,3430282,JHARKHAND,GIRIDIH,"At: Mohanpur, P.O: Pachamba, Dist: Giridih.",815316,6532,"226529 ,",,06532226529,principal.hhts@gmail.com,http://www.honeyholytrinity.org,1994,1/9/1994 12:00:00 AM,Anita Sinha,0,"M.A, B.Ed.",5,10,Secondary School,Provisional,1/4/2016,31/3/2021,Yad Ali Memorial Educational Trust
JAWAHAR NAVODAYA VIDYALAYA,3440008,JHARKHAND,GIRIDIH,NAVODAYA GRAM AT & PO GANDEY DISTT GIRIDIH JHARKHAND,815312,6532,"239235 ,",39235,,sthiyagarajan_jnv@rediffmail.com,,1988,3/31/2012 12:00:00 AM,S THIYAGARAJAN,0,,,,Senior Secondary,Provisional,1/4/2010,31/ 3/ 2015,Navodaya Vidyalaya Samiti
K.D. International School,3430258,JHARKHAND,GIRIDIH,"Village: Gangapur, P.O: Orkhar, Via: Rajdhanwar, District: Giridih, Jharkhand",825412,0,"9771805450 ,",,,rakeshkumarkdis@gmail.com,,2009,1/31/2009 12:00:00 AM,RAKESH KUMAR,1,"M.Sc, B.Ed",10,12,Senior Secondary,Provisional,1/4/2017,31/ 3/ 2022,K.D. Educational Society
kiran public school,3430334,JHARKHAND,GIRIDIH,"koldiha,giridih",815301,6532,"250077 ,",,,suryaprakashpkps@gmail.com,http://www.kiranpublicschool.com,2009,3/3/2009 12:00:00 AM,SURYA PRAKASH,,"B.A. ,B.ed",2,30,Secondary School,Provisional,1/4/2016,31/3/2019,Anjali singh smt sulochana devi memorial
L.N.P PUBLIC SCHOOL,3430305,JHARKHAND,GIRIDIH,AT-BENGABAD P.O-BENGABAD DIST-GIRIDIH PIN -815312,815312,0,"7903128525 ,",,,lnppublicschoolgrd@gmail.com,,2009,4/2/2009 12:00:00 AM,NIRANJANA PRIYADARSHANI,0,MA B.ED,05,10,Secondary School,Provisional,1/4/2017,31/3/2022,SHAKUNTALA EDUCATIONAL AND CHARITABLE TRUST
Manthan Valley St. Alberts School,3430349,JHARKHAND,GIRIDIH,"Balwagarh, Rajdhanwar",825412,91,"9431531828 ,","01302214772, 9584675575",06532222483,atamshantideb@gmail.com,,2005,3/8/2005 12:00:00 AM,DEBASHISH KAR,0,B.A LLB,14,14,Secondary School,Provisional,1/4/2017,31/3/2020,Manthan Valley Educational Trust
"PROGRESSIVE PUBLIC SCHOOL,JAMTARA,DUMRI(GIRIDIH)",3430357,JHARKHAND,GIRIDIH,AT+PO-JAMTARA(PROF.COLONY)P.S-DUMRI,825106,6558,"233531 ,",,06558233531,wasimdumri@gmail.com,http://www.progressivepublicschooljamtaradumri,2008,3/6/2008 12:00:00 AM,SARWAR ALI,,"M.A, B.Ed",5,8,Secondary School,Provisional,1/4/2017,31/3/2020,N.M.Educational and Welfare Trust
SARASWATI SHISHU VIDYA MANDIR,3430166,JHARKHAND,GIRIDIH,BARGANDA PO GIRIDH DISTT GIRIDH JHARKHAND,815301,6532,"225465 ,",0755-2489602,,MMMISHRA321@GMAIL.COM,www.sagargroupbhopal.org,1984,4/2/2007 12:00:00 AM,MADAN MOHAN MISHRA,2,Ph.D,35,35,Senior Secondary,Provisional,1/4/2018,31/ 3/ 2019,VIDYA VIKAS SAMITI
SHREE GURUNANK VIDALAYA,3430252,JHARKHAND,GIRIDIH,STATION ROAD GIRIDIH,815301,6532,"224996 ,",,065322252068,sgnv.grd@gmail.com,,1972,2/11/1972 12:00:00 AM,SWAPNA KUMAR,0,B.A. B.ED,10,15,Senior Secondary,Provisional,1/4/2017,31/ 3/ 2020,SHREE GURUNANAK EDUCATIONAL SOCIETY
"SRI RAM KRISHAN DAV PUBLIC SCHOOL,",3430320,JHARKHAND,GIRIDIH,VIVEKANAND MARG SURIYA,825320,91,"7282000761 ,",,,davsuriya@gmail.com,,2010,7/1/2010 12:00:00 AM,ARUN KUMAR JHA,0,"M.A., B.Ed.",3,14,Senior Secondary,Provisional,1/4/2017,31/ 3/ 2020,"DAV College Managing Committee, New Delhi"
ST. MARYS PUBLIC SCHOOL,3430372,JHARKHAND,GIRIDIH,"AT-NETAJEE PARK,PO+PS-SURIYA",825320,,"09576635608 ,",,,st.mps2010@yahoo.com,,2010,4/20/2010 12:00:00 AM,Mr.DINESH CHANDRA YADAV,,MSc B-Ed,5,10,Secondary School,Provisional,1/4/2018,31/3/2021,SHRI RAM LAKHAN WELFARE FOUNDATION
SUBHASH PUBLIC SCHOOL,3430107,JHARKHAND,GIRIDIH,NEW OFFICERS COLONY MOHLICHAWEN KOLDIHA GIRIDIH JHARKHAND,815301,6532,"250166 ,",223046,06532-2260,chaudhuri.reena@yahoo.com,,1991,4/2/1994 12:00:00 AM,REENA CHAUDHURI,2,"B.Ed,Mphil,M.A.Eng",11,15,Senior Secondary,Provisional,1/4/2013,31/ 3/ 2018,P S & SMT. DEVI PUB EDNL.TRUST
BETHEL MISSION SCHOOL,3430379,JHARKHAND,GODDA,"WARD NO.-20, KADWA TOLA, GANGTA, GODDA",814133,,"06422-221040 ,",,,bethel.mission@yahoo.com,,2000,2/24/2000 12:00:00 AM,MRS. ANNA MARC,1,"MA, B.ED",5,15,Secondary School,Provisional,1/4/2018,31/3/2021,INTERNATIONAL PEACE FOUNDATION
D A V PUBLIC SCHOOL,3430095,JHARKHAND,GODDA,E C L RAJMAHAL AREA URJANAGAR PO MAHAGAMA DISTT. GODDA JHARKHAND,814154,6437,"228327 ,",228328,,davurjanagar@gmail.com,,1994,4/6/2006 12:00:00 AM,B P YADAV,2,"M.A. , B.SC, B.ED",5,5,Senior Secondary,Provisional,1/4/2014,31/ 3/ 2019,D A V COLLEGE & MANAGING COMMITTEE
JAWAHAR NAVODAYA VIDYALAYA,3440006,JHARKHAND,GODDA,LALMATIA DHANKUNDA PO BARA SIMRA DISTT GODDA JHARKHAND,814165,0,"9798385047 ,",48,,dinesh_bdk1963@rediffmail.com,,1987,3/31/2011 12:00:00 AM,DINESH KUMAR,0,,,,Senior Secondary,Provisional,1/4/2019,31/ 3/ 2024,NAVODAYA VIDYALAYA SAMITI
KENDRIYA VIDYALAYA,3400034,JHARKHAND,GODDA,"GODDA, HIGH SCHOOL CAMPUS, DISTT. GODDA, JHARKHAND",814133,0642,"2223998 ,",,,ldsabhi@gmail.com,,1998,4/1/1991 12:00:00 AM,LALDHAR S YADAV,0,,,,Senior Secondary,Provisional,1/4/2017,31/ 3/ 2020,KENDRIYA VIDYALAYA SANGATHAN
St.Michael Anglo-Indian School,3430271,JHARKHAND,GODDA,"Mohanpur,Mohanpur(P O)Mahagama,Godda.",814154,91,"9334193826 ,",,,principal@stmais.in,,2004,2/7/2004 12:00:00 AM,BIJU KAVUNKAL,0,"B A,BEd",4,9,Secondary School,Provisional,1/4/2015,31/3/2020,Kerala Educational Society(Trust)
"D.A.V. PUBLIC SCHOOL, GUMLA",3430219,JHARKHAND,GUMLA,"NEEMTOLI(BEHIND POLICE LINE), LOHARDAGA ROAD, DISTT GUMLA, JHARKHAND",835207,6524,"9472785092 ,",,06524223320,davgumla@gmail.com,,1996,4/2/1996 12:00:00 AM,DILIP KUMAR MAHATO,1,M.Sc. B.Ed.,11,17,Senior Secondary,Provisional,1/4/2018,31/ 3/ 2023,"D.A.V. COLLEGE TRUST AND MANAGEMENT SOCIETY, NEW DELHI-55"
JAWAHAR NAVODAYA VIDYALAYA,3440001,JHARKHAND,GUMLA,MASARIA DAM GHAGHRA DISTT GUMLA JHARKHAND,835208,6423,"290636 ,",3110,,scpandajnv@gmail.com,,1986,4/1/1991 12:00:00 AM,SUBASH CHANDRA PANDA,0,,,,Senior Secondary,Provisional,1/4/2016,31/ 3/ 2021,NVS
KENDRIYA VIDYALAYA,3400036,JHARKHAND,GUMLA,"GUMLA, AT-TRAINING SCHOOL CAMPUS, KARAMTOLI, PO GUMLA, DISTT. GUMLA, JHARKHAND",835207,6524,"221042 ,",,,nvtoppo@gmail.com,,1998,4/1/1991 12:00:00 AM,NILIMA V TOPPO,1,,,,Senior Secondary,Provisional,1/4/2017,31/ 3/ 2022,kendriya vidyalaya sangathan
MONTFORT SENIOR SECONDARY SCHOOL,3430312,JHARKHAND,GUMLA,"KONBIR NOATOLI BASIA, GUMLA",835229,0653,"8102907198 ,",,06533223324,brosudhasg@gmail.com,http://www.montfortschoolnoatoli.org,2005,4/1/2005 12:00:00 AM,Yeruva Sudhakar,0,"M.SC. , M.ED.",5,10,Secondary School,Provisional,1/4/2018,31/3/2023,Brothers of St. Gabriel Education Society
NOTRE DAME SCHOOL,3430212,JHARKHAND,GUMLA,PALKOT ROAD TARRIBARTOTLI,473331,6524,"9431116966 ,",,07492 - 220002,savitasnd@yahoo.com,,1998,7/1/2009 12:00:00 AM,SISTER MARY SAVITA SND,0,"M.A., B.Ed.",3,5,Senior Secondary,Provisional,1/4/2018,31/ 3/ 2019,Tishir Siksha Prasar Samiti
SARASWATI VIDYA MANDIR HIGH SCHOOL.,3430122,JHARKHAND,GUMLA,GUMLA DSP ROAD DISTT GUMLA JHARKHAND,835207,0652,"4223683 ,",9835320992,,suneelmedininagar@gmail.com,,1986,6/25/2007 12:00:00 AM,Suneel Kumar Pathak,2,"M.A,. M.Ed., Ph.D",05,12,Senior Secondary,Provisional,1/4/2016,31/ 3/ 2019,"VIDYA VIKAS SAMIT,"
Solitaire Educational Academy,3430363,JHARKHAND,GUMLA,"Solitaire Educational Academy ,Makara,Ghaghra, Gumla",835208,,"08877176749 ,",,08877176749,solitaireeducationalacademy@gmail.com,http://www.solitairegumla.co.in,2011,3/7/2011 12:00:00 AM,Mr.Sudha Toppo,,M.A. B.Ed,5,10,Secondary School,Provisional,4/1/2017,31/3/2020,Education Aim (EduAim)
AGRASEN DAV PUB. SCHOOL,3430128,JHARKHAND,HAZARIBAGH,P.O BHARECH NAGAR VIA RAMGARH CANTT DISTT HAZARIBAGH JHARKHAND,829146,6553,"256801 ,",06553-256103,256623,mkm62.dav@gmail.com,www.agrasendav.in,1993,4/1/2001 12:00:00 AM,MANOJ KUMAR MISHRA,1,"M.A., B.Ed.,",15,25,Senior Secondary,Provisional,1/4/2016,31/ 3/ 2021,DAV COLLEGE TRUST & MANAGING SOC.
Angels High School,3430276,JHARKHAND,HAZARIBAGH,"Barkagaon Road, Block- Katkamdag, Shankarpur, HAzaribag, Pin.-825301",825301,0654,"262518 ,",,06546223053,angelshighschool2008@gmail.com,http://www.angelshighschool.in,2008,4/16/2008 12:00:00 AM,SWATI AGRAWAL,2,B.A & B.Ed,5,13,Senior Secondary,Provisional,1/4/2016,31/ 3/ 2018,Braj KIshore Educational Trust
ARMY PUBLIC SCHOOL,3480003,JHARKHAND,HAZARIBAGH,RAMGARH CANTT. DISTT.HAZARI BAGH JHARKHAND,829122,06553,"222107 ,",222526,222107,armyschool@yahoo.co.in,,1991,9/26/1995 12:00:00 AM,Mr MB Choubey,1,"M.Sc, B.Ed",05,10,Senior Secondary,Provisional,1/4/2013,31/ 3/ 2021,ARMY WELFARE EDUCATION SOCIETY
BAL VIDYA MANDIR,3430032,JHARKHAND,HAZARIBAGH,ARA COLLIERY P.O. SARUBERA (KUJU) HAZARIBAGH DISTT JHARKHAND,829134,6545,"253543 ,",06542-253723,,www.nageshwarthakur238@gmail.com,,1979,7/1/2005 12:00:00 AM,NAGESHWAR THAKUR,2,MSC MATHS,11,20,Secondary School,Provisional,1/4/2015,31/3/2020,WELFARE COMMTTEE OF ARA COLLIERY
CAMPION BASIC ACADEMY,3430336,JHARKHAND,HAZARIBAGH,AT & POST - ICHAK,825402,6548,"285273 ,",229148,,gsb_cba@rediffmail.com,,2005,3/5/2005 12:00:00 AM,Ganesh Shankar Bidyarthi,1,"BA, B.ED",10,5,Secondary School,Provisional,1/4/2016,31/3/2019,MANAV VIKAS
D A V PUBLIC SCHOOL,3430113,JHARKHAND,HAZARIBAGH,TAPIN NORTH (R R W) P.O. TAPIN DISTT. HAZARIBAGH JHARKHAND,825326,6546,"231001 ,",,,DAVPSTAPIN_NORTH@YAHOO.COM,,1990,3/16/1987 12:00:00 AM,DR RANI JAISWAL,1,M.A.B.Ed.,6,15,Senior Secondary,Provisional,1/4/2016,31/ 3/ 2019,D A V COLLEGE & MANAGING COMMITTEE
d a v public school,3430127,JHARKHAND,HAZARIBAGH,p o 71 canary hill road hazaribagh jharkhand,825301,6546,"260345 ,",06546267345,261345,akumar267345@gmail.com,,1992,4/1/2005 12:00:00 AM,ASHOK KUMAR,1,"m.a., b.ed.",18,21,Senior Secondary,Provisional,1/4/2018,31/ 3/ 2019,d a v college trust& management
D A V PUBLIC SCHOOL,3430202,JHARKHAND,HAZARIBAGH,PATRATU THERMAL POWER STATION PATRATU DISTT HAZARIBAGH JHARKHAND,829119,91,"7781968215 ,",286989,,shivratnaprasad@gmail.com,,1992,7/1/2005 12:00:00 AM,SHIV RATNA PRASAD,1,,,,Secondary School,Provisional,1/4/2014,31/3/2019,DAV COLLEGE TRUST & MGMT SOCIETY
D A V PUBLIC SCHOOL,3430030,JHARKHAND,HAZARIBAGH,ARA KUJU AREA P O SARUBERA HAZARIBAGH DISTT JHARKHAND,829134,6545,"267170 ,",06545267065,267170,davarakuju@gmail.com,,1982,,RAJESH KUMAR ROY,1,"M.A. Eng., B.Ed.",15,22,Senior Secondary,Provisional,1/4/2013,31/ 3/ 2018,D A V COLLEGE TRUST & MANAGING SOC.
D A V PUBLIC SCHOOL,3430031,JHARKHAND,HAZARIBAGH,RAJRAPPA PROJECT P O HAZARIBAGH DISTT JHARKHAND,829210,0,"9234300963 , 32078",,,davrrp@gmail.com,,1982,7/3/2000 12:00:00 AM,HIMANSHU KUMAR JHA,1,MA ENG. B.ED.,15,22,Senior Secondary,Provisional,1/4/2015,31/ 3/ 2020,D A V COLLEGE TRUST & MANAGING SOC.
DAV PUBLIC SCHOOL,3430172,JHARKHAND,HAZARIBAGH,URIMARI SAYAL PO SAYAL DISTT HAZARIBAGH JHARKHAND,829125,91,"9431990125 ,",,,davps.urimari@yahoo.com,,1994,4/1/2002 12:00:00 AM,UTTAM KUMAR ROY,1,M.A.Eng,12,11,Senior Secondary,Provisional,1/4/2017,31/ 3/ 2022,DAV COLLEGE TRUST &MGMT SOC
DAV PUBLIC SCHOOL,3430105,JHARKHAND,HAZARIBAGH,KEDLA CCL P O KEDLA DISTT HAZARIBAGH JHARKHAND,825325,0,"9234300971 ,",61031,,npyadav1963@gmail.com,,1990,7/1/2005 12:00:00 AM,NAKUL PRASAD YADAV,1,M.A B.Ed,25,30,Senior Secondary,Provisional,1/4/2015,31/ 3/ 2020,D A V COLLEGE & MANAGING COMMITTEE
DAV PUBLIC SCHOOL,3430330,JHARKHAND,HAZARIBAGH,"NEAR SDO OFFICE, G.T ROAD, BARHI",825405,6543,"266587 ,",,06543266587,ashokkumarsingh7211@gmail.com,,2003,4/24/2004 12:00:00 AM,ASHOK KUMAR SINGH,,"M.A History,B.Ed.",8,14,Secondary School,Provisional,1/4/2016,31/3/2019,DAV COLLEGE TRUST & MANAGEMENT SOCIETY
"DAV Public School,",3430222,JHARKHAND,HAZARIBAGH,"P.O.-Gidi-A, CCL, Argada Area.",829108,91,"9234368481 ,",,06553-272716,davpublicschoolgidia@rediffmail.com,,2003,4/1/2003 12:00:00 AM,MANOJ KUMAR SINHA,0,"M.A. (Pol. Sc.), B.Ed.",10,15,Senior Secondary,Provisional,1/4/2015,31/ 3/ 2020,DAV College Trust & Management Society
"DAV PUBLIC SCHOOL, TOPA",3430310,JHARKHAND,HAZARIBAGH,"AT/PO-TOPA COLLIERY, DISTT. RAMGARH (HAZARIBAGH), STATE-JHARKHAND",825330,0,"9234368480 ,",,,davtopa2012@gmail.com,,1995,7/10/1995 12:00:00 AM,RAJENDRA PRASAD,0,"M.A.(ECO.), B.ED.",17,7,Secondary School,Provisional,1/4/2015,31/3/2018,"DAV COLLEGE MANAGING COMMITTEE, NEW DELHI"
DELHI PUBLIC SCHOOL,3430317,JHARKHAND,HAZARIBAGH,"NEAR TV TOWER BARKAGAON ROAD, HAZARIBAG,825301",825301,0654,"223470 ,",,,dpshazaribag@gmail.com,http://www.dpshazaribag.com,2013,1/15/2013 12:00:00 AM,RENU KUMARI SINHA,1,"M.Sc,Bed,M.A.",8,10,Senior Secondary,Provisional,1/4/2018,31/ 3/ 2021,GREEN VALLEY EDUCATIONAL TRUST
DIVINE PUBLIC SCHOOL,3430325,JHARKHAND,HAZARIBAGH,"AT+PO-GANGPACHO,PS-BARKATHA,DIST-HAZARIBAGH",825323,6543,"06543210092, ,",,,dpsbarkatha@gmail.com,,2010,4/1/2010 12:00:00 AM,MR.KAMLESH KUMAR,1,"M.A., B.Ed.",5,10,Senior Secondary,Provisional,1/4/2018,31/ 3/ 2021,DIVINE KALYAN KENDRA
Holy Cross School,3430304,JHARKHAND,HAZARIBAGH,"Holy Cross Road, Opp. PTC Ground Hazaribag",825301,0654,"272337 ,",,,simonkiran@gmail.com,,2006,4/18/2006 12:00:00 AM,Kirthi Kiran,0,M.A BEd. Ph.D.,12,30,Senior Secondary,Provisional,1/4/2019,31/ 3/ 2024,Holy Cross Institite
HOLY CROSS SCHOOL,3430055,JHARKHAND,HAZARIBAGH,GHATOTAND WEST BOKARO DT.HAZARIBAGH JHARKHAND,825314,6545,"260078 , 262326",06545260326,6545260004,holycross_tisco@yahoo.co.in,,1983,6/3/2002 12:00:00 AM,Sister Kamala Paul,2,"B.A.Hons, B.Ed,",26,32,Senior Secondary,Provisional,1/4/2018,31/ 3/ 2023,H C INSTITUTE & TISCO
HOLY CROSS VOCATIONAL TRAINING INSTITUTE,3430035,JHARKHAND,HAZARIBAGH,HAZARI BAGH JHARKHAND,825301,6546,"224773 ,",2658,,shalet05@gmail.com,http://www.ssrvm.g,1980,6/4/2001 12:00:00 AM,SISTER SHALET,0,"m.sc., b.ed",3,11,Senior Secondary,Provisional,1/4/2015,31/ 3/ 2020,HOLY CROSS SISTERS HAZARIBAG
