RED ROSE SCHOOL,3430163,JHARKHAND,deoghar,CASTAIRS TOWN B DEOGHAR JHARKHAND,814112,0,"9430385464 ,",235471,,principal.redrose.school.deo@gmail.com,,1990,4/1/2012 12:00:00 AM,RAMSEVAK SINGH,0,,,,Senior Secondary,Provisional,1/4/2016,31/ 3/ 2021,RED ROSE EDUCATIONAL TRUST
SHALOM SCHOOL,3430343,JHARKHAND,deoghar,PRINCIPAL LALGARH MADHUPUR JHARKHAND,815353,0,"9934379273 ,",,00,shalomschool@live.com,,2005,5/1/2005 12:00:00 AM,Pintu Kumar,,MA BEd,2,2,Secondary School,Provisional,1/4/2016,31/3/2019,BHARATHYA CHRISTI SEVA DAL TRUST
SKP VIDYA VIHAR,3430295,JHARKHAND,deoghar,"BOMPASS TOWN,B.Deoghar. Jharkhand",814112,6432,"292985 ,",,,smohan142@gmail.com,,1999,4/4/2000 12:00:00 AM,SURAJ MOHAN LAL DAS,0,"M.Com,P.Hd.",10,15,Senior Secondary,Provisional,1/4/2016,31/ 3/ 2019,SKP CHARITABLE TRUST
St. Xavier's High School Deoghar,3430231,JHARKHAND,deoghar,"Deoghar, Satar road,Durgapur,Dist.Deoghar,Jharkhand (814112)",814112,6432,"9199345172 ,",09431132086,,principalxavier@outlook.com,,2006,4/6/2006 12:00:00 AM,N SANTHOSH KUMAR,2,"M.Sc.Physics,M.Ed.",2,14,Senior Secondary,Provisional,1/4/2014,31/ 3/ 2019,B.P Angles'' Group of Educational Society
Sunrise Dwarika Academy,3430262,JHARKHAND,deoghar,"At Baijnathpur, P.S. Kunda",814112,6432,"291834 ,",225003,,raghuvarsharan505@gmail.com,www.sunrisedwarikaacademy.tk,1993,1/9/1993 12:00:00 AM,RAGHUVAR SHARAN,2,"M.A.,B.Ed.",3,8,Senior Secondary,Provisional,1/4/2014,31/ 3/ 2017,Sunrise Dwarika Memorial Charitable Trust
TAKSHASHILA VIDYAPITH,3430257,JHARKHAND,deoghar,"PT. B.N. JHA ROAD, B. DEOGHAR,JHARKHAND",814115,6432,"275474 ,",,06432 275485,pradyutghosh12@yahoo.in,,2010,3/18/2010 12:00:00 AM,PRADYUT GHOSH,0,"HS, BSC, MA,BED,AMIE, PGD IN COMP & MGT",28,28,Senior Secondary,Provisional,1/4/2016,31/ 3/ 2021,hindi vidyapith
THE BLUE BELLS SCHOOL,3430211,JHARKHAND,deoghar,"BAWAN BIGHA CASTAIRS TOWN B, DEOGHAR DEOGHAR Jharkhand",814112,91,"9801421810 ,",,,naresh.bbs@gmail.com,,1929,4/3/1989 12:00:00 AM,Anima Naresh,2,,,,Secondary School,Provisional,1/4/2015,31/3/2020,manzil educational society
THE RAMA KRISHNA VIVEKANANDA VIDYA MANDIR,3430100,JHARKHAND,deoghar,AT & P.O. JASIDIH DIST.DEOGHAR JHARKHAND,814142,6432,"7070194791 ,",09431132086,,contact@therkvvm.org,http://www.therkvvm.org,1983,4/15/2008 12:00:00 AM,ASHOKA KAR,2,"BA,BEd",13,28,Senior Secondary,Provisional,1/4/2014,31/ 3/ 2019,THE RAMAKRISHNA VIVEKANANDA VID.MAN
ADARSH SHRAMIK UCHCH VIDYALAYA,3430084,JHARKHAND,DHANBAD,GOLUKDIH OPEN CART PROJECT AT- GOLUKDIH P.O.JHARIA DISTT.DHANBAD JHARKHAND,828111,0326,"2290009 ,",,,asuvidyalaya@ymail.com,,1979,4/4/2005 12:00:00 AM,SHIO KUMAR SINGH,0,,,,Secondary School,Provisional,1/4/2015,31/3/2020,"ADARSH SHRAMIK UCHCHA VIDYALAYA MANAGING COMMITTEE,GOLUKDIH."
BALKIA VIDYA MANDIR,3430142,JHARKHAND,DHANBAD,JHARIA PO JHARIA DHANBAD JHARKHAND,828111,0326,"2240372 ,",2201711,07774203241,roy.ajanta1963@gmail.com,http://www.montft.com,1961,7/4/2001 12:00:00 AM,Ajanta Roy,0,ma. b. ed,,,Senior Secondary,Provisional,1/4/2015,31/ 3/ 2020,JHARIA MARWARI SAMMELAN TRUST
BUDS GARDEN SCHOOL,3430311,JHARKHAND,DHANBAD,"DALUDIH, PO+PS-RAJGANJ, BAGHMARA, DHANBAD, JHARKHAND",828113,0326,"8539993608 ,",,,pramod.buds@gmail.com,,2000,4/1/2000 12:00:00 AM,PRAMOD KUMAR,0,M.A. BED,10,10,Secondary School,Provisional,1/4/2015,31/3/2018,BUDS GARDEN EDUCATIONAL SOCIETY
CHASNALLA ACADEMY,3430026,JHARKHAND,DHANBAD,P O CHASNALLA DHANBAD DISTT JHARKHAND,828135,0326,"62385171 ,",2382649,,ajit.kumar.principal@gmail.com,,1973,4/1/1974 12:00:00 AM,AJIT KUMAR,0,,,,Senior Secondary,Provisional,1/4/2018,31/ 3/ 2023,CHASNALLA JITPUR SCH EXECUTIVE COM
D A V CENTENARY PUBLIC SCHOOL,3430068,JHARKHAND,DHANBAD,BANIAHIR LODNA AREA P.O. BHAGA DISTT. DHANBAD JHARKHAND,828301,0326,"2361439 , 0326",,,subratomodak@gmail.com,,1986,6/18/2009 12:00:00 AM,SUBRATA MODAK,0,,,,Senior Secondary,Provisional,1/4/2015,31/ 3/ 2020,D A V COLLEGE & MANAGING COMMITTEE
D A V MODEL SCHOOL,3430028,JHARKHAND,DHANBAD,C F R I P.O. F R I DHANBAD DISTT JHARKHAND,828108,0326,"2381158 ,",913262901972,2381158,nnsrivastavadnb@yahoo.com,,1978,8/12/2007 12:00:00 AM,N N SRIVASTAVA,1,"M.Sc.,B.Ed.",13,9,Senior Secondary,Provisional,1/4/2018,31/ 3/ 2020,DAV COLLEGE MANAGING COMMITEE ND
D A V PUBLIC SCHOOL,3430003,JHARKHAND,DHANBAD,ALKUSA COLLIERY P O KUSUNDA DHANBAD JHARKHAND,828116,0326,"2332617 , 73285",2330278,2332617,sanjayksinha.6216@gmail.com,,1982,,SANJAY KUMAR SINHA,1,"M.SC, B.ED",2,17,Senior Secondary,Provisional,1/4/2003,31/ 3/ 2008,DAV COLLEGE MANAGING COMMITTE N DEL
D A V PUBLIC SCHOOL,3430041,JHARKHAND,DHANBAD,MOONIDIH PROJECT P O MOONIDIH DHANBAD JHARKHAND,828129,0326,"2273337 ,",,,plmoonidih@gmail.com,,1984,8/12/2007 12:00:00 AM,MAHENDRA PRASAD SINGH,0,,,,Senior Secondary,Provisional,1/4/2014,31/ 3/ 2019,DAV COLLEGE MANAGING COMMITTEE
D A V PUBLIC SCHOOL,3430019,JHARKHAND,DHANBAD,KUSUNDA COLLIERY AREA 6 P O KUSUNDA DHANBAD DISTT JHARKHAND,828116,0326,"2330025 ,",2330025,06546233350,pplkusunda@gmail.com,http://www.namanvidya.com,1982,4/22/2005 12:00:00 AM,UDAY SHANKAR PANDEY,2,"M.A, B.A, B.ED, L.L.B",3,8,Senior Secondary,Provisional,1/4/2017,31/ 3/ 2022,DAV CMC CHITRA GUPTA ROAD N DELHI
D A V PUBLIC SCHOOL,3430108,JHARKHAND,DHANBAD,BARORA (BCCL) PO NAWAGARH DT DHANBAD JHARKHAND,828306,0326,"2393652 ,",61031,,skdav1967@gmail.com,,1989,7/1/2005 12:00:00 AM,Sunil Kumar,1,M.A B.Ed,25,30,Senior Secondary,Provisional,1/4/2017,31/ 3/ 2020,D A V COLLEGE & MANAGING COMMITTEE
D A V PUBLIC SCHOOL,3430131,JHARKHAND,DHANBAD,MAHUDA P O MAHUDA DISTT DHANBAD JHARKHAND,828305,0091,"9234364809 ,",286989,,ashokamitgolu@gmai.com,,1993,7/1/2005 12:00:00 AM,ASHOK KUMAR SINGH,1,,,,Secondary School,Provisional,1/4/2015,31/3/2020,DAV COLLEGE MANG. COMMTT.N.D.
DAV PUBLIC SCHOOL,3430148,JHARKHAND,DHANBAD,KOYLA NAGAR DHANBAD JHARKHAND,826005,0326,"2230715 ,",261234,,kcsdav@gmail.com,,2000,7/1/2005 12:00:00 AM,KAILASH CHANDRA SRIVASTAVA,0,,,,Senior Secondary,Provisional,1/4/2018,31/ 3/ 2019,"DAV COLLEGE TRUST & MGMT SOC, ND"
"DAV Public School,",3430246,JHARKHAND,DHANBAD,"Rangamatia, Sindri Dhanbad",828122,0326,"2350333 ,",2758565,0326-2350333,ashutoshmairh@gmail.com,,1999,6/21/1999 12:00:00 AM,ASHUTOSH KUMAR,1,"M.Sc, PhD., B.Ed.",10,27,Senior Secondary,Provisional,1/4/2015,31/ 3/ 2020,DAV College Trust and Management Society
DELHI PUBLIC SCHOOL,3430052,JHARKHAND,DHANBAD,KARMIK BHAWAN DHANBAD (POST OFFICE ISM) DISTT DHANBAD JHARKHAND,826004,0326,"2203259 , 2203864",3864,,kbbhargava59@gmail.com,,1988,7/1/2005 12:00:00 AM,KUL BHUSHAN BHARGAVA,2,MSC MATHS,11,20,Senior Secondary,Provisional,1/4/2015,31/ 3/ 2020,D P C SOCIETY & B C C L
DHANBAD CITY SCHOOL,3430145,JHARKHAND,DHANBAD,BHULI ROAD BYE PASS B POLYTECHNIC DHANBAD,828130,0326,"9234302209 , 205459",03262211621,,tksinha_dcs@rediffmail.com,,2001,4/13/2007 12:00:00 AM,T K SINHA,1,M SC B ED,14,20,Senior Secondary,Provisional,1/4/2014,31/ 3/ 2019,AGZHA MEMORIAL TRUST
DHANBAD PUBLIC SCHOOL,3430086,JHARKHAND,DHANBAD,GOVINDPUR ROAD(NEAR BHUIPORE MANDIR) P.O. K G ASHRAM DHANBAD JHARKHAND,828109,0326,"9204794995 ,",0326-2207287,2208777,principaldps1989@gmail.com,www.dpsdhanbad.blogspot.c,1989,11/3/2007 12:00:00 AM,SHARDA MAHAJAN,1,,,,Senior Secondary,Provisional,1/4/2014,31/ 3/ 2019,SHIKSHA VIKAS TRUST
"DHANBAD PUBLIC SCHOOL,HIRAK BR",3430242,JHARKHAND,DHANBAD,"PO.O. NAGNAGAR,",826004,0326,"9234301915 ,",,0326-2208777,principal.kkmdps@gmail.com,,2000,3/7/2001 12:00:00 AM,Purnima Sil,1,"M.A., B.Ed",8,7,Senior Secondary,Provisional,1/4/2018,31/ 3/ 2021,SHIKSHA VIKAS TRUST
DON BOSCO,3430316,JHARKHAND,DHANBAD,"VILL-RAMKANALI, P.O- NIRSHA, CITY-DHANBAD, NIRSHA",828205,0,"9204064582 ,",,0236-6550868,donboscoramkanali@gmail.com,,1996,7/1/1996 12:00:00 AM,L BHASKAR RAO,1,M.A. BEd,10,12,Secondary School,Provisional,1/4/2018,31/3/2023,Karam singh saini memorrial turst
DOON PUBLIC SCHOOL,3430115,JHARKHAND,DHANBAD,KUSUM VIHAR KOYLA NAGAR DHANBAD JHARKHAND,826005,0326,"2230713 , 207780",25099545,03812342572,doon_sunil@yahoo.co.in,,2001,4/1/2005 12:00:00 AM,BINOD KUMAR SINGH,2,"Ba, BEd",5,10,Senior Secondary,Provisional,1/4/2012,31/ 3/ 2017,KUSUM VIHAR EDUCATION TRUST
Dwarika memorial foundation academy,3430291,JHARKHAND,DHANBAD,At-Bishunpur p.o-B Polytechnic Dist-Dhanbad,828130,0326,"9234134797 ,",,,dmfacademy@gmail.com,,2004,4/5/2004 12:00:00 AM,VANDANA VIHAR,0,"Bsc,Bed",6,8,Secondary School,Provisional,1/4/2017,31/3/2022,Aaryavart Utthan Samiti
GGCET ST XAVIERS INTERNATIONAL SCHOOL,3430235,JHARKHAND,DHANBAD,"NAWADIH, PO-B.POLYTECHNIC, DHANBAD, JHARKHAND",828130,0326,"6451349 ,",,,raviom07@rediffmail.com,http://www.xis.edu.in,2006,4/18/2008 12:00:00 AM,RAVI PRAKASH TIWARY,0,MSc. BEd.,16,19,Senior Secondary,Provisional,1/4/2015,31/ 3/ 2020,GANESH AND GITA CHARITABLE AND EDUCATIONAL TRUST
GURU GOBIND SINGH PUBLIC SCHOOL,3430210,JHARKHAND,DHANBAD,DHANBAD JHARKHAND,826001,0326,"2301035 ,",,,principalggpsdhn@gmail.com,,1981,8/12/2007 12:00:00 AM,UMAKANT BARAL,0,,,,Senior Secondary,Provisional,1/4/2018,31/ 3/ 2019,A S DADHWAL GGSPS
HOLY MOTHER'S ACADEMY,3430170,JHARKHAND,DHANBAD,PO KATRASGARH DISTT DHANBAD JHARKHAND,828114,0,"8539836602 ,",9431125738,,vijayaroy2012@gmail.com,,1987,4/15/2008 12:00:00 AM,VIJAYA ROY,2,"M.A,BEd",,,Senior Secondary,Provisional,1/4/2014,31/ 3/ 2019,MEENAKSHI MEMO EDN SOCIETY
IMPERIAL SCHOOL OF LEARNING,3430091,JHARKHAND,DHANBAD,BHULI DHANBAD JHARKHAND,828104,0326,"6555519 ,",,0161-2224682,sksingh5410@gmail.com,,1981,4/1/2002 12:00:00 AM,SHAILENDRA KUMAR SINGH,0,"M.A, B.Ed",3,10,Senior Secondary,Provisional,1/4/2017,31/ 3/ 2022,ACADEMIC QUEST
INDIAN SCHOOL OF LEARNING,3430034,JHARKHAND,DHANBAD,SUDAMDIH P O SUDAMDIH PROJECT DHANBAD DISTT JHARKHAND,828126,0326,"2383141 ,",2380706,25554363,isljks@rediffmail.com,,1977,7/1/2005 12:00:00 AM,JUGAL KUMAR SARKAR,2,"M.A , B.ED",10,10,Senior Secondary,Provisional,1/4/2015,31/ 3/ 2018,ACADMIC QUEST
INDIAN SCHOOL OF LEARNING SR SEC SCH,3430009,JHARKHAND,DHANBAD,KATRAS MORH P O JHARIA DHANBAD DISTT JHARKHAND,828111,0326,"2460532 , 2460532",2205266,,isljharia1@gmail.com,,1977,4/2/2014 12:00:00 AM,HEMANT KUMAR THAKUR,0,,,,Senior Secondary,Provisional,1/4/2017,31/ 3/ 2022,SOCIETY ACADEMIC QUEST
JAWAHAR NAVODAYA VIDYALAYA,3440017,JHARKHAND,DHANBAD,"BENAGARIA VIA NIRSA, DHANBAD, JHARKHAND",828205,91,"9430351509 ,",,,shashikrsinha1965@gmail.com,,1993,3/31/2012 12:00:00 AM,SHASHI KUMAR SINHA,2,,,,Senior Secondary,Provisional,1/4/2010,31/ 3/ 2020,Navodaya Vidyalaya Samiti
JAWAHARLAL NEHRU MEMORIAL SCHOOL,3430033,JHARKHAND,DHANBAD,DIGWADIH NO. 12 PO PATHERDIH DHANBAD DISTT JHARKHAND,828119,0326,"2380739 ,",09431120188,2380139,reach2rchy@gmail.com,,1975,7/3/2000 12:00:00 AM,Runa Dubey,1,M Sc Maths M Ed,22,30,Senior Secondary,Provisional,1/4/2017,31/ 3/ 2022,NEHRU COUNCIL FOR CHILD WELFARE
Jharkhand Public School,3430352,JHARKHAND,DHANBAD,P.O. Balipaur,828201,91,"9204064800 ,",,,principal.jpsb@gmail.com,http://www.jpsbaliapur.org,2006,4/4/2006 12:00:00 AM,KALPANA SARKAR,,"MA, B.Ed.",5,10,Secondary School,Provisional,1/4/2017,31/3/2020,Baliapur Rural Welfare Society
JITPUR ACADEMY,3430027,JHARKHAND,DHANBAD,P O JITPUR DHANBAD DISTT JHARKHAND,828108,0326,"2320363 ,",60484,,anitaverma828309@gmail.com,,1974,6/2/2003 12:00:00 AM,ANITA VERMA,0,,,,Secondary School,Provisional,1/4/2014,31/3/2019,CHASNALA JITPUR SCHOOL COMMITTEE
KENDRIYA VIDYALAYA,3400014,JHARKHAND,DHANBAD,BHULI TOWNSHIP SRAMIK NAGAR DHANBAD JHARKHAND,828104,,"2535 ,",,,helpdesk@xeenet.xeedhn.xeemail.com,,1983,,P C MISHRA,0,,,,Senior Secondary,Provisional,19/3/1991,31/ 3/ 2000,KENDRIYA VIDYALAYA SANGATHAN
KENDRIYA VIDYALAYA,3400017,JHARKHAND,DHANBAD,MAITHON DAM DHANBAD DISTT JHARKHAND,828207,654,"274379 ,",06540-252451,274379,way2jmppl@gmail.com,http://www.kvmaithon.org,1985,,JOSEPH MUNDU,1,"M.Sc.Phy.,B.Ed,PGDGC,CIG",06,18,Senior Secondary,Provisional,1/4/2007,31/ 3/ 2008,KENDRIYA VIDYALAYA SANGATHAN
KENDRIYA VIDYALAYA,3400018,JHARKHAND,DHANBAD,B C C L GOVINDPUR AREA P O TUNDOO DHANBAD JHARKHAND,828128,,"72247 ,",,,helpdesk@xeenet.xeedhn.xeemail.com,,1983,,V N CHATURVEDI,0,,,,Secondary School,Provisional,14/10/1988,31/3/2000,KENDRIYA VIDYALAYA SANGATHAN
KENDRIYA VIDYALAYA,3400022,JHARKHAND,DHANBAD,NEAR RAILWAY STATION PO GOMOH DT DHANDBAD JHARKHAND,828401,0326,"2472318 ,",,,pchandrakvg@gmail.com,,1986,,PREM CHANDRA,,,,,Senior Secondary,Provisional,1/4/2010,31/ 3/ 2011,KENDRIYA VIDYALAYA SANGATHAN
KENDRIYA VIDYALAYA,3400011,JHARKHAND,DHANBAD,KOYALANAGAR B C C L TOWNSHIP P O KOYALANAGAR DHANBAD JHARKHAND,826005,,"5406 ,",,,helpdesk@xeenet.xeedhn.xeemail.com,,1981,,M RRADHAKRISHNAN,0,,,,Senior Secondary,Provisional,19/3/1991,31/ 3/ 2002,KENDRIYA VIDYALAYA SANGATHAN
KENDRIYA VIDYALAYA,3400007,JHARKHAND,DHANBAD,OLD D V S BUILDING NEAR RLY CLUB ( E R) DHANBAD JHARKHAND,826001,326,"2310551 ,",3455,,kv1dhanbad@gmail.com,www.kvntpckaniha.g,1973,4/1/1991 12:00:00 AM,Ranjan Kishore,1,,,,Senior Secondary,Provisional,1/4/2016,31/ 3/ 2019,KENDRIYA VIDYALAYA SANGATHAN
KENDRIYA VIDYALAYA NO.2,3400028,JHARKHAND,DHANBAD,"BEHIND POLICE STATION, JAGJIWAN NAGAR DHANBAD, JHARKHAND",826003,0326,"2210705 ,",,,sansin_phy@hotmail.com,,1998,4/1/1991 12:00:00 AM,SANJIB SINHA,2,,,,Secondary School,Provisional,1/4/2014,31/3/2019,KENDRIYA VIDYALAYA SANGATHAN
KIDS GARDEN SECONDARY SCHOOL,3430203,JHARKHAND,DHANBAD,SINDRI ROAD PO JHARIA DISTT DHANBAD JHARKHAND,828111,0326,"2460792 ,",2205266,,kidsgarden05@yahoo.in,,1988,7/1/2005 12:00:00 AM,SHOBHA SINHA,2,24,14,10,Senior Secondary,Provisional,1/4/2016,31/ 3/ 2021,INDIAN EDUCATION TRUST
LIONS PUBLIC SCHOOL,3430038,JHARKHAND,DHANBAD,P O SINDRI DHANBAD DISTT JHARKHAND,828122,0326,"245343 ,",06766235214,0676623531,lpssindri8025@gmail.com,,1975,4/1/2005 12:00:00 AM,RAMESH SHARMA,1,MA B Ed,21,27,Senior Secondary,Provisional,1/4/2018,31/ 3/ 2019,SINDRI EDUCATION TRUST SINDRI
MAHARSHI MEHI VIDYAPEETH,3430281,JHARKHAND,DHANBAD,"LOHARDIH,KOLAKUSMA(HIRAK ROAD ,P.O-K.G.ASHRAM,DHANBAD-828109(JHARKHAND)",828109,0326,"6001929 ,",,0326-6001929,maharshimehi@gmail.com,,2005,4/15/2005 12:00:00 AM,SHYAM NARAYAN SINGH,2,"M.Sc,B.Ed",10,7,Secondary School,Provisional,1/4/2016,31/3/2021,MAHARISHI MEHI VIDYA VIKASH TRUST
MODEL ENGLISH HIGH SCHOOL,3430011,JHARKHAND,DHANBAD,P O SINDRI F C I SINDRI DHANBAD DISTT JHARKHAND,828122,0629,"4314 ,",5025,,dnp@fcis.bih.nic.in,,1954,,S B SRIVASTAVA,0,,,,Senior Secondary,Provisional,1/4/1997,31/ 3/ 2003,FERTILISER CORPN. OF INDIA LTD.
MONTFORT ACADEMY,3430365,JHARKHAND,DHANBAD,"DAYABANS PAHAR , NH-2 NEAR GANGA HOTEL , TOPCHANCHI - 828112",828112,,"9006880279 ,",,01125012068,montfortacademy@hotmail.com,http://www.montfortacademy.com,2013,8/18/2013 12:00:00 AM,Mr.SUNAHALI SHAH,,M.A B.COM,10,5,Secondary School,Provisional,4/1/2017,31/3/2020,SHANTI GYAN PAWAN KUMAR EDUCATIONAL TRUST
"Mount Litera Zee School, Dhanbad",3430347,JHARKHAND,DHANBAD,"Mount Litera Zee School, Dhanbad, Baukala, Bhuli, Hirak Road, Dhanbad",818104,2922,"03266550372 ,",,,principal.dhanbad@mountlitera.com,http://mountliterazeedhn.org.in,2014,4/14/2014 12:00:00 AM,Mr.Rakesh Kumar Bhagat,1,"MA (history), B.Ed, MBA(Edn. Mgt)",3,15,Secondary School,Provisional,1/4/2017,31/3/2020,Bapu Educational Charitable Trust
NANDA GOKULAM,3430045,JHARKHAND,DHANBAD,B I T SINDRI INSTITUTE DISTT DHANBAD JHARKHAND,828123,,",",,,,,1983,,MRS. NACHARI,0,,,,Secondary School,Provisional,22/8/1991,31/3/1995,NANDA GOKULAM MANAGING COMMITTEE
"Nirmala School, Govindpur",3430366,JHARKHAND,DHANBAD,"G.T. Road, Jealgora, KG Ashram, Govindpur",828109,0654,"262490 ,",,0326-2313024,surinjames25@gmail.com,http://www.damiensocialwelfarecentre.com,1968,11/1/1968 12:00:00 AM,James Surin,,"MA, BEd",5,4,Secondary School,Provisional,1/4/2017,31/3/2020,"Damien Social Welfare Centre, Dhanbad"
raj kamal saraswati vidya mandir,3430048,JHARKHAND,DHANBAD,ashok nagar dhanbad jharkhand,828106,0326,"2303099 ,",2646268,2525644,dnb_rajkamal@yahoo.co.in,,1978,4/1/2005 12:00:00 AM,RAJESH KUMAR SINGH,1,"ma ,b ed , ph d",05,20,Senior Secondary,Provisional,1/4/2018,31/ 3/ 2023,bal kalyan samiti dhanbad
SARASWATI SHISHU MANDIR,3430104,JHARKHAND,DHANBAD,SHYAMDIH KATRAS BAZAR DISTT.DHANBAD JHARKHAND,828114,0326,"2372669 ,",,,singhsachitanand@gmail.com,,1993,7/1/2005 12:00:00 AM,SACHITA NAND SINGH,1,,,,Senior Secondary,Provisional,1/4/2015,31/ 3/ 2020,BALA KALYAN TRUST
saraswati shishu vidya mandir,3430161,JHARKHAND,DHANBAD,baghmara po navagarh distt dhanbad jharkhand,828306,0326,"2428360 ,",9431732881,,rrsharmaprincipalsvm@gmail.com,www.ssvmbaghmara.in,1979,7/1/2008 12:00:00 AM,RAJA RAM SHARMA,1,"m.sc, b.ed",6,15,Senior Secondary,Provisional,1/4/2014,31/ 3/ 2019,bal kalyan samiti baghmara
SARASWATI VIDYA MANDIR,3430150,JHARKHAND,DHANBAD,SINIDHIH GOVINDPUR AREA PO TUNDOO DISTT DHANBAD JHARKHAND,828128,0326,"2392102 , 2393111",9430755435,,sksinhasvm@gmail.com,,2000,8/12/2007 12:00:00 AM,SANJEEV KUMAR SINHA,1,"M.A, B.ED, M.COM",20,26,Senior Secondary,Provisional,1/4/2018,31/ 3/ 2019,VIDYA VIKAS SAMITI
SARASWATI VIDYA MANDIR,3430144,JHARKHAND,DHANBAD,BHULI PO SHRAMIK NAGAR DHANBAD JHARKHAND,828105,0326,"2341620 ,",2340041,,harinarayans045@gmail.com,,2000,7/8/1998 12:00:00 AM,HARI NARAYAN SHARMA,0,"M.A., B.Ed",05,27,Senior Secondary,Provisional,1/4/2017,31/ 3/ 2022,VIDYA VIKAS SAMITI BIHAR
SARASWATI VIDYA MANDIR,3430047,JHARKHAND,DHANBAD,SINDRI DISTT DHANBAD JHARKHAND,828122,0326,"2245740 ,",235549,,shivbalakprasad@gmail.com,,1981,4/30/2019 12:00:00 AM,shio balak prasad,1,"M.A., B.ED., B.P.ED.",02,09,Senior Secondary,Provisional,1/4/2014,31/ 3/ 2019,SHISHU SHIKSHA PRABANDH SAMITI BR.
SCHOOL OF COMPETITION,3430174,JHARKHAND,DHANBAD,TALDANGA HOUSING PO SARISA PAHARI VIA CHIRKUNDA DISTT DHANBAD JHARKHAND,828202,6540,"272142 ,",,,sanjiv.svs@gmail.com,,1984,7/1/2005 12:00:00 AM,SANJIV KUMAR SHAW,0,"M.Sc.(Chemistry, M.Ed., M.Phil",06,10,Senior Secondary,Provisional,1/4/2015,31/ 3/ 2020,ROHINI EDUCATION EXPANSION TRUST
SMT GINIA DEVI MODERN SCHOOL,3430134,JHARKHAND,DHANBAD,CHIRKUNDA DISTT DHANBAD JHARKHAND,828202,6540,"273177 , 23177",03412281982,273177,zubinbose13@rediffmail.com,,1993,7/1/2005 12:00:00 AM,ZUBIN BOSE,1,MA BED,20,25,Senior Secondary,Provisional,1/4/2015,31/ 3/ 2020,GINIA DEVI CHAR. TRUST
SRI SRI SURYA DEO SINGH SMRITI,3430191,JHARKHAND,DHANBAD,GURUKULAM PO SARAIDHELA DHANBAD JHARKHAND,828127,0326,"2205721 ,",9835516146,3262209407,tahseenahmed3260@gmail.com,,2007,8/12/2007 12:00:00 AM,S M TAHSEEN AHMAD,1,M.com B.Ed,15,20,Senior Secondary,Provisional,1/4/2017,31/ 3/ 2022,SURYADEO SINGH MEMORIAL FOUNDATION
ST THOMAS HIGH SCHOOL,3430237,JHARKHAND,DHANBAD,NH-2 SAHUBAHIYAR TOPCHANCHI DHANBAAD JHARKHAND,828402,0326,"6550868 ,",,,sthsprincipal@yahoo.com,,1997,9/1/1997 12:00:00 AM,SANDEEP R DEY,0,M.A/B.ed,22,7,Senior Secondary,Provisional,1/4/2014,31/ 3/ 2019,St Thomas School Managing Committe
symbiosis public school,3430292,JHARKHAND,DHANBAD,"barwadda,nh-2 kalyanpur,dhanbad 826004 jharkhand",826004,0326,"3262293055 ,",,03262293040,indranighosh7@gmail.com,,2010,4/9/2010 12:00:00 AM,INDRANI GHOSH,2,M.Ed,,,Senior Secondary,Provisional,1/4/2017,31/ 3/ 2019,vivekanand social and educational trust
symbiosis public school,3430392,JHARKHAND,DHANBAD,"barwadda,nh-2 kalyanpur,dhanbad 826004 jharkhand",826004,,"03262293055 ,",,03262293055,symbiosispublicschool@yahoo.in,http://www.symbiosisdhn.org,2010,9/4/2010 12:00:00 AM,Mrs.MRS.INDRANI GHOSH,,"M.Sc., B.Ed",14,34,Senior Secondary,Provisional,1/4/2016,31/ 3/ 2019,Vivekanand Social and Educational Trust
TATA D A V SCHOOL,3430075,JHARKHAND,DHANBAD,PIT NO 3 JAMADOBA P.O. JAMADOBA DISTT. DHANBAD JHARKHAND,828112,0326,"2320654 ,",03262320654,,dav_jamadoba@yahoo.co.in,,2006,4/2/2007 12:00:00 AM,A K PANDEY,1,"MSc Maths,MA Eng.B.Ed",14,24,Senior Secondary,Provisional,1/4/2017,31/ 3/ 2022,D A V COLLEGE MANAGING COMMITTEE
TATA DAV SCHOOL (TISCO),3430101,JHARKHAND,DHANBAD,SIJUA P.O. BHELATAND DHANBAD JHARKHAND,828103,0326,"2372625 , 2372814",,,tatadavsijua@ymail.com,www.vidyashilp.in,1998,6/9/2008 12:00:00 AM,ANIL KUMAR SINGH,0,"MA, B.Ed, PGDCA",05,08,Senior Secondary,Provisional,1/4/2014,31/ 3/ 2019,D A V COLLEGE & MANAGING COMMITTEE
TERESA BLOCK,3430273,JHARKHAND,DHANBAD,"KUSUM VIHAR, KOYLA NAGAR",826005,0326,"2230822 ,",,0326-2230822,kvetteresa@yahoo.com,,2001,3/22/2001 12:00:00 AM,RANJU SINGH,0,M.A.B.ED,8,7,Senior Secondary,Provisional,1/4/2015,31/ 3/ 2018,KUSUM VIHAR EDUCATION TRUST
VALLEY PUBLIC SCHOOL,3430368,JHARKHAND,DHANBAD,"AT- PATLABARI,PO-BENAGORIA VIA MUGMA,DHANBAD,JHARKHAND-828204",828204,,"06540-284231 ,",,06540-284244,valleypublicschool2@gmail.com,http://valleypublicschool.com,2000,2/21/2000 12:00:00 AM,Mrs.LALITA KUMARI,,"M.A,B.Ed",2,5,Secondary School,Provisional,4/1/2017,31/3/2020,PATLABARI JANKALYAN TRUST
eklavya model residential school,3420001,JHARKHAND,DUMKA,"at- kathijia, post- kathijia, dist.- dumka, jharkhand- 814101",,,",",,,,,,4/12/2018 12:00:00 AM,.,0,,,,Secondary School,,Secondary School,,Secondary School
JAWAHAR NAVODAYA VIDYALAYA,3440003,JHARKHAND,DUMKA,HANSDIHA DUMKA JHARKHAND,814145,6431,"248110 ,",290745,,jnvdumka2011@gmail.com,,1986,4/1/1991 12:00:00 AM,Devendra Kumar,0,,,,Senior Secondary,Provisional,1/4/2015,31/ 3/ 2018,NAVODAYA VIDYALAYA SAMITI
SACRED HEART SCHOOL,3430327,JHARKHAND,DUMKA,P.O. - DUMKA(H.P.O.),814101,6434,"236191 ,",78144,,principalshsdumka@gmail.com,,2007,3/19/2007 12:00:00 AM,SHANTA KERKETTA,0,"M.A., B.Ed.",10,10,Secondary School,Provisional,1/4/2019,31/3/2024,DUMKA CATHOLIC DIOCESE
SIDO KANHU HIGH SCHOOL,3430186,JHARKHAND,DUMKA,VILLAGE PALASH DANGAL BLOCK RAGHUNATHPUR RAMESHWAR DISTT DUMKA JHARKHAND,814148,6434,"224597 ,",,,sidokanhurgp88@gmail.com,,1982,7/1/2005 12:00:00 AM,LILA CHAL BHANDARI,0,"M.Sc.(Chemistry, M.Ed., M.Phil",06,10,Senior Secondary,Provisional,1/4/2015,31/ 3/ 2020,SEWA DUMKA
SIDO KANU HIGH SCHOOL,3430125,JHARKHAND,DUMKA,THANA ROAD DUMKA P O DUMKA DISTT DUMKA JHARKHAND,814101,6434,"2236520 ,",,,naresh020566@gmail.com,,1992,2/1/2007 12:00:00 AM,NARESH CHANDRA THAKUR,1,M.A.BP.ED,7,10,Secondary School,Provisional,1/4/2015,31/3/2020,SEWA DUMKA BIHAR
AIWC ACADEMY OF EXECELLENCE,3430223,JHARKHAND,EAST SINGHBHUM,"DIHING ROAD, OLD BARIDIH, DHALBHUM, JAMSHEDPUR, EAST SINGHBHUM, JHARKHAND",831017,0657,"2213349 ,",9915070521,0183-2700808,jasbeergill@rediffmail.com,,2003,3/4/2003 12:00:00 AM,JASBEER KAUR GILL,2,"m.a, b.ed",02,20,Senior Secondary,Provisional,1/4/2018,31/ 3/ 2023,st.xaviers education trust
ATOMIC ENERGY CENTRAL SCHOOL,3480002,JHARKHAND,EAST SINGHBHUM,P O JADUGUDA MINES SINGHBHUM DISTT JHARKHAND,832102,0891,"235 ,",310,06546263332,uciljd@ucil_jd.bih.nic.in,http://www.aecs1jaduguda.nic.in,1965,4/3/2003 12:00:00 AM,HAROON RASHID KHAN,2,"MA (Economics),B.Ed",10,15,Senior Secondary,Provisional,1/5/1981,1/ 5/ 2019,ATOMIC ENERGY EDUCATION SOCY
ATOMIC ENERGY CENTRAL SCHOOL,3480005,JHARKHAND,EAST SINGHBHUM,NARWAPAHAR POST NARWAPAHAR VIA SUNDERNAGAR SINGHBHUM DISTT HQ JAMSHEDPUR JHARKHAND,832107,0657,"2741609 ,",06572741750,2741609,aecsnrw@yahoo.co.in,,1991,4/1/2005 12:00:00 AM,Mr. DILEEP SINGH,1,"M.COM,GRAD.CWA,B.ED",5,14,Secondary School,Provisional,1/4/2013,31/3/2021,ATOMIC ENERGY EDUCATION SOCIETY
"Atomic Energy Central School,",3480006,JHARKHAND,EAST SINGHBHUM,"Turamdih, via Sundernagar, East Singhbhum Distt.",832107,0657,"6571518 ,",06572741609,,aecstmd@yahoo.co.in,,,6/8/2018 12:00:00 AM,S.K. SARANGI,0,,,,Secondary School,Provisional,1/4/2018,31/3/2021,
atomic energy central school-2,3480010,JHARKHAND,EAST SINGHBHUM,"po jaduguda mines district east singhbhum, mosabani, jharkhand",832102,0657,"2730951 ,",9818430125,,cstb@sanchernet.in,,1987,4/1/1991 12:00:00 AM,MR BABU RAM,0,,,,Secondary School,Provisional,1/4/2017,31/3/2020,directate of education
B S S PRANAV CHILDREN WORLD,3430046,JHARKHAND,EAST SINGHBHUM,RIVERS MEET ROAD P O SONARY WEST JAMSHEDPUR JHARKHAND,831011,0657,"2301760 ,",0657-2281801,2301760,sumitadey24@yahoo.com,,1978,4/1/2009 12:00:00 AM,Mrs. Shamita Rakshit,2,M.Sc. B.Ed,4,14,Senior Secondary,Provisional,1/4/2016,31/ 3/ 2021,BHARAT SEVASHRAM SANGH
BALDWIN FARM AREA HIGH SCHOOL,3430206,JHARKHAND,EAST SINGHBHUM,KADMA JAMSHEDPUR EAST SINGHBHUM JHARKHAND,825325,0657,"2310195 ,",61031,,baldwin.jsr@gmail.com,,1990,7/1/2005 12:00:00 AM,SUBHOSREE SARKAR,1,M.A B.Ed,25,30,Senior Secondary,Provisional,1/4/2015,31/ 3/ 2020,BALDWIN ACADEMY
BLUE BELLS ENGLISH HIGH SCHOOL,3430300,JHARKHAND,EAST SINGHBHUM,"TURIA BERA BHILAI PAHARI, MANGO, JAMSHEDPUR",831012,0657,"6060200 ,",,,principaljsr@gmail.com,,1981,1/12/1981 12:00:00 AM,Subra Sarkar,0,"M.SC, LLB, B.ED",12,7,Senior Secondary,Provisional,1/4/2016,31/ 3/ 2019,SHANTI DEVI JAN KALYAN SAMITTEE
"CHINMAYA VIDYALAYA, SOUTHPARK",3430243,JHARKHAND,EAST SINGHBHUM,"SOUTH PARK, BISTUPUR,EAST SINGHBHUM",831001,0657,"6573061 ,",,,mikkisingh77@gmail.com,,2003,4/1/2003 12:00:00 AM,Mikki Singh,0,,,,Senior Secondary,Provisional,1/4/2016,31/ 3/ 2021,Shri. Ratnesh Jan Kalyan Siksha Samiti
DAV PUBLIC SCHOOL,3430135,JHARKHAND,EAST SINGHBHUM,CONTRACTOR AREA ROAD NO. 4 BISTUPUR JAMSHEDPUR JHARKHAND,831001,0657,"2226745 , 433309",,,principal@davbistupur.org,,1995,,PRAGYA SINGH,0,,,,Senior Secondary,Provisional,1/4/2014,31/ 3/ 2019,"DAV COLLEGE TRUST MANG. SOCIETY, N."
DBMS KADMA HIGH SCHOOL,3430266,JHARKHAND,EAST SINGHBHUM,"ROAD NO. 23,FARM AREA, KADMA",831005,0657,"2310239 ,",9891581307,,buglimeena@gmail.com,,2003,1/21/2004 12:00:00 AM,MEENA BUGLI,2,"M.A, B.ED",25,25,Senior Secondary,Provisional,1/4/2017,31/ 3/ 2022,DAKSHINA BHARATA MAHILA SAMAJ
DELHI PUBLIC SCHOOL,3430184,JHARKHAND,EAST SINGHBHUM,"TURIABERA, POST BHILAI PAHARI, MANGO THANA MGM, JAMSHEDPUR JHARKHAND",831012,0657,"2942873 , 2362370",06572901451,2362371,dpsjsr.in@gmail.com,,1992,6/1/2001 12:00:00 AM,KIRANDEO SINGH,1,M.Sc. M.Phil. M.Ed.,13,22,Senior Secondary,Provisional,1/4/2015,31/ 3/ 2020,DELHI PUB SCHOOL SOCIETY AND VISWA GYAN PUNJ TRUST
