Name of Institution,Affiliation Number,State,District,Postal Address,Pincode,Std Code,Office Phone No,Residence Phone No,Fax No,Email,Website,Year of Foundation,Date of First Opening of School,Name of Principal/Head of Institution,Sex,Principals Educational Professional Qualifications,Administrative No of Experience(in Years),Teaching No of Experience(in Years),Status of the School,Type of Affiliation,Affiliation Period From,Affiliation Period To,Name of Trust/Society/Managing Committee
A R S PUBLIC SCHOOL,3430192,JHARKHAND,BOKARO,B S L LH BOKARO STEEL CITY JHARKHAND,800018,6542,"09204780407 ,",,,biswajitpatra4869@rediffmail.com,,2005,7/1/2005 12:00:00 AM,BISWAJIT PATRA,0,,,,Senior Secondary,Provisional,1/4/2016,31/ 3/ 2021,A R S MEMORIAL EDUCATIONAL SOCIETY
ADARSH VIDYA MANDIR,3430089,JHARKHAND,BOKARO,BYE PASS ROAD CHAS BUS STAND BOKARO JHARKHAND,827013,6542,"265171 ,",06542265559,265559,cghosh1973@gmail.com,,1970,,CHINMOY GHOSH,1,"B.Ed., L.LB.",4,10,Senior Secondary,Provisional,1/4/2014,31/ 3/ 2019,MARWARI PANCHAYAT CHAS BOKARO
BHARAT SINGH PUBLIC SCHOOL,3430058,JHARKHAND,BOKARO,PO BERMO DISTT BOKARO JHARKHAND,829104,6549,"222387 , 218",458,,bharatsinghpublicschoolbermo@gmail.com,,1981,8/12/2007 12:00:00 AM,DR MRIDUL RAKESH KUMAR SINGH,1,"B.Sc,B.Ed,M.A,MHR",12,21,Secondary School,Provisional,1/4/2013,31/3/2018,ACADEMY QUEST
BOKARO ISPAT SR SEC SCHOOL,3430059,JHARKHAND,BOKARO,SECTOR II C BOKARO STEEL CITY JHARKHAND,827001,6542,"286792 ,",,,rabindrajha70@gmail.com,,1974,7/15/1999 12:00:00 AM,Rabindra Jha,1,"M.A.Eng, Pol.Sc., B.T.",15,34,Senior Secondary,Provisional,1/4/2018,31/ 3/ 2023,BOKARO STEEL PLANT SAIL UNIT
BOKARO ISPAT SR SEC SCHOOL,3430060,JHARKHAND,BOKARO,SECTOR III BOKARO STEEL CITY JHARKHAND,827003,6542,"266399 ,",9450021827,,BSLBISSS3@GMAIL.COM,,1966,1/14/2000 12:00:00 AM,PRAMOD KUMAR,1,M. Com. B. Ed.,05,18,Senior Secondary,Provisional,1/4/2013,31/ 3/ 2018,BOKARO STEEL PLANT SAIL UNIT
bokaro ispat sr. sec. school,3430077,JHARKHAND,BOKARO,sect-viii b bokaro steel city jharkhand,827009,6542,"262004 ,",06542276029,,tarunkumarghosh43@gmail.com,,1984,7/1/2005 12:00:00 AM,Tarun Kumar Ghosh,1,m.a. b.ed.,15,20,Senior Secondary,Provisional,1/4/2014,31/ 3/ 2019,bokaro steel plant
BOKARO ISPAT VIDYALAYA,3430078,JHARKHAND,BOKARO,SECTOR-II A P.O. BOKARO STEEL CITY JHARKHAND,827001,,"7814 ,",,0712-3271030,info@tccsngp.org,http://www.tccsngp.org,1992,6/1/2010 12:00:00 AM,SH. KASHI NATH GOSWAMI,0,"B.Sc.(PCM), M.Sc.(Chem), B.Ed., M.Ed.",5,8,Secondary School,Provisional,1/4/2009,31/3/2014,BOKARO STEEL PLANT
BOKARO ISPAT VIDYALAYA,3430079,JHARKHAND,BOKARO,SECTOR-VIII C BOKARO STEEL CITY JHARKHAND,827009,6542,"287788 ,",,,krishnakumaribsbv@gmail.com,,1992,6/2/2000 12:00:00 AM,DR K KUMARI,0,,,,Secondary School,Provisional,1/4/2013,31/3/2018,BOKARO STEEL PLANT
BOKARO ISPAT VIDYALAYA,3430080,JHARKHAND,BOKARO,SECTOR-XI D BOKARO STEEL CITY JHARKHAND,827009,6542,"260262 ,",8986872677,,principalbiv11d@gmail.com,,1992,4/1/2002 12:00:00 AM,DEVENDRA PANDA,1,"M.Sc . Maths, B.Ed.",05,21,Senior Secondary,Provisional,1/4/2017,31/ 3/ 2019,BOKARO STEEL PLANT.
bokaro ispat vidyalaya,3430081,JHARKHAND,BOKARO,sect-xii e bokaro steel city jharkhand,827012,6542,"81357 ,",3864,,biv12e@gmail.com,,1992,7/1/2005 12:00:00 AM,MANOJ KUMAR MISHRA,2,msc maths,11,20,Secondary School,Provisional,1/4/2014,31/3/2019,bokaro steel plant
BOKARO ISPAT VIDYALAYA,3430082,JHARKHAND,BOKARO,SECTOR-IX-C BOKARO STEEL CITY JHARKHAND,827009,6542,"240227 ,",3864,,dhirendrapsinha@gmail.com,,1992,7/1/2005 12:00:00 AM,DHIRENDRA PRASAD SINHA,2,MSC MATHS,11,20,Secondary School,Provisional,1/4/2014,31/3/2019,BOKARO STEEL PLANT
BOKARO ISPAT VIDYALAYA,3430083,JHARKHAND,BOKARO,SECTOR-IV A BOKARO STEEL PLANT JHARKHAND,827004,6542,"287788 ,",,,jks04051959@gmail.com,,1992,,JAINENDRA KUMAR SINGH,0,,,,Secondary School,Provisional,1/4/2014,31/3/2019,BOKARO STEEL PLANT
BOKARO ISPAT VIDYALAYA,3430061,JHARKHAND,BOKARO,SECTOR XII A BOKARO STEEL CITY JHARKHAND,827012,06542,"7814 ,",442823,,anpal@md3.vsnl.net.in,,1991,,MR M SANKARA NARAYANAN,0,,,,Secondary School,Provisional,1/4/2008,31/3/2013,BOKARO STEEL PLANT SAIL UNIT
BOKARO ISPAT VIDYALAYA,3430062,JHARKHAND,BOKARO,SECTOR III A BOKARO STEEL CITY JHARKHAND,827003,6542,"287788 ,",,,biv3a.bsl.edu.in@gmail.com,,1991,,PRABHA M NAIR,0,,,,Secondary School,Provisional,1/4/2013,31/3/2018,BOKARO STEEL PLANT SAIL UNIT
BOKARO ISPAT VIDYALAYA,3430064,JHARKHAND,BOKARO,SECTOR I C BOKARO STEEL CITY JHARKHAND,827001,0,"0 , 82049",,,keya.moyna@gmail.com,,1991,4/1/2002 12:00:00 AM,SUKANYA BANDOPADHYAY,1,"M.A.Hist.,B.L, B.Ed.",15,33,Secondary School,Provisional,1/4/2013,31/3/2018,BOKARO STEEL PLANT SAIL UNIT
BOKARO ISPAT VIDYALAYA,3430065,JHARKHAND,BOKARO,SECTOR IX D BOKARO STEEL CITY JHARKHAND,827009,6542,"287743 , 6751",,,usdwivedybiv3a@gmail.com,,1991,6/25/2009 12:00:00 AM,UDAY SHANKAR DWIVEDI,0,,,,Secondary School,Provisional,1/4/2013,31/3/2018,BOKARO STEEL PLANT SAIL UNIT
BOKARO ISPAT VIDYALAYA,3430066,JHARKHAND,BOKARO,SECTOR VIII D BOKARO STEEL CITY JHARKHAND,827009,6542,"287742 , 7742",08986872646,,shekhar296@gmail.com,,1991,4/6/2003 12:00:00 AM,CHANDRA SHEKHAR AZAD,1,"M.A , B.Ed",15,32,Secondary School,Provisional,1/4/2013,31/3/2018,BOKARO STEEL PLANT SAIL UNIT
BOKARO ISPAT VIDYALAYA,3430067,JHARKHAND,BOKARO,SECTOR VI A BOKARO STEEL CITY JHARKHAND,827006,6542,"266399 , 82049",24640133,,biswaldp12@gmail.com,,1991,4/6/2003 12:00:00 AM,DURGA PRASAD BISWAL,2,M.A.B.Ed,16,25,Secondary School,Provisional,1/4/2013,31/3/2018,BOKARO STEEL PLANT SAIL UNIT
BOKARO ISPAT VIDYALAYA,3430063,JHARKHAND,BOKARO,SECTOR II D BOKARO STEEL CITY JHARKHAND,827001,6542,"220137 ,",,,skpandey2b@gmail.com,,1991,,SHASHI KANT PANDEY,0,,,,Secondary School,Provisional,1/4/2013,31/3/2018,BOKARO STEEL PLANT SAIL UNIT
BOKARO PUBLIC SCHOOL,3430197,JHARKHAND,BOKARO,SECTOR 3-C BOKARO STEEL CITY DISTT BOKARO JHARKHAND,827003,6452,"243195 , 243195",9334725101,245033,shekhar.sudha.01@gmail.com,http://www.bokaropublicsc,1988,7/1/2005 12:00:00 AM,SUDHA SHEKHAR,1,,,,Senior Secondary,Provisional,1/4/2017,31/ 3/ 2022,SAINIK SHIKSHA PRASAR SAMITI
brl dav public school,3430097,JHARKHAND,BOKARO,bhandaridah distt bokaro jharkhand,829132,6549,"239243 ,",06549239245,239243,hazra_ss1996@rediffmail.com,,1998,7/9/2003 12:00:00 AM,SHYAM SUNDAR HAZRA,1,"m.sc, m.ed",10,14,Senior Secondary,Provisional,1/4/2018,31/ 3/ 2023,d a v college & managing committee
Carmel School Kargali,3430326,JHARKHAND,BOKARO,"Carmel School Kargali PO - Bermo, Dist - Bokaro, Jharkhand",829104,6549,"220596 ,",,,anjali98.chf@gmail.com,,1957,3/3/1957 12:00:00 AM,Jessy PC,,"M.A, B.Ed",7,14,Secondary School,Provisional,1/4/2016,31/3/2019,The Poreyahat Holy Family Society
Chinmaya Vidyalaya,3430013,JHARKHAND,BOKARO,sect v bokaro steel city bokaro jharkhand,827006,6542,"269609 , 7314","0654268943,268297",,principalcvbokaro@gmail.com,www.chinmayabokaro.co.in,1977,4/4/1976 12:00:00 AM,ASHOK SINGH,1,"M.Sc,M.Ed,Ph.D(Maths)",21,10,Senior Secondary,Provisional,1/4/2018,31/ 3/ 2023,"central chinmaya mission trust,bby"
CRESCENT PUBLIC SCHOOL,3430189,JHARKHAND,BOKARO,SECT VI BOKARO STEEL CITY JHARKHAND,827006,6542,"268696 ,",256886,268696,anil.crescent@yahoo.com,,1970,6/5/2000 12:00:00 AM,Anil Kumar Gupta,1,"MA,M Phil, BEd",08,15,Senior Secondary,Provisional,1/4/2011,31/ 3/ 2016,GYANDEEP SHIKSHAN SANSTHAN
D A V PUBLIC SCHOOL,3430076,JHARKHAND,BOKARO,KATHARA C C L P O KATHARA DISTT BOKARO JHARKHAND,829116,6549,"235346 ,","06549(235588), 09931155304",,davkatharamk@gmail.com,,1989,7/1/2005 12:00:00 AM,DR MANOJ KUMAR,1,"M.Sc, Ph.D, B.Ed, FZSI, FAZ",16,"22, Experience as a Principal(10 Yrs)",Senior Secondary,Provisional,1/4/2009,31/ 3/ 2014,D A V COLLEGE MANAGING COMMITTEE ND
d a v public school,3430010,JHARKHAND,BOKARO,sect iv bokaro steel city bokaro distt jharkhand,827004,6542,"232034 , 272084",272084,,davbokaro@yahoo.co.in,,1973,4/1/2002 12:00:00 AM,ARUN KUMAR,1,,,,Senior Secondary,Provisional,1/4/2014,31/ 3/ 2019,dav college managing committee n d
D A V PUBLIC SCHOOL,3430029,JHARKHAND,BOKARO,CENTRAL COLONY DHORI P O PHUSRO BAZAR BOKARO DISTT JHARKHAND,829144,6549,"220249 ,",220528,220249,dav_dhori@yahoo.com,www.davdhori.com,1982,7/1/2004 12:00:00 AM,SATYENDRA KUMAR,1,M.A. B.ED,15,12,Senior Secondary,Provisional,1/4/2015,31/ 3/ 2020,COAL INDIA LIMITED
D A V PUBLIC SCHOOL,3430094,JHARKHAND,BOKARO,P O SAWANG COLLIERY DISTT. BOKARO JHARKHAND,829128,6544,"261228 , 6228",6469,,dav.sawang@gmail.com,,1989,7/1/1994 12:00:00 AM,Achyuta Nand Routaray,2,,,,Senior Secondary,Provisional,1/4/2015,31/ 3/ 2020,DAV COLLEGE MANAGING COMMITEE
"D.A.V. PUBLIC SCHOOL,SEC-VI",3430244,JHARKHAND,BOKARO,"D.A.V. PUBLIC SCHOOL SEC-VI, BOKARO STEEL CITY - 827 006 (JHARKHAND)",827006,6542,"068894 ,",,06542 276894,neelkamalsinha@gmail.com,,1993,4/1/1993 12:00:00 AM,NEELKAMAL SINHA,0,"B.Sc., B.Ed.",12,21,Senior Secondary,Provisional,1/4/2016,31/ 3/ 2021,"DAV College Managing Comittee,New Delhi"
DAV PUBLIC SCHOOL,3430106,JHARKHAND,BOKARO,TENUGHAT THERMAL POWER STATION P.O.LALPANIA DISTT.BOKARO JHARKHAND,829149,0654,"4225453 ,",06544-225453,225453,jhaarun001@gmail.com,,1990,,ARUN KUMAR JHA,1,"M.Sc.Zoology,B.Ed.",20,25,Senior Secondary,Provisional,1/4/2014,31/ 3/ 2019,D A V COLLEGE & MANAGING COMMITTEE
DAV PUBLIC SCHOOL,3430146,JHARKHAND,BOKARO,PO DUGDA DISTT BOKARO JHARKHAND,828404,6549,"244361 ,",742312,0591-2411864,davdugda@gmail.com,,2000,7/1/2005 12:00:00 AM,ANIL KUMAR PANDEY,0,b.sc. b.ed.,05,12,Senior Secondary,Provisional,1/4/2015,31/ 3/ 2020,DAV COLLEGE & MANAGING SOC DELHI
"DAV Public School,",3430319,JHARKHAND,BOKARO,"Tenughat Dam PO - Tenughat, Dist.-Bokaro",829123,0654,"230460 ,",,,davps_tenughat@rediffmail.com,http://www.davtenughat.com,2003,4/4/2003 12:00:00 AM,ARCHANA MISHRA,2,"MA (English), B. Ed.",18,31,Senior Secondary,Provisional,1/4/2017,31/ 3/ 2020,DAV COLLEGE TRUST & MANAGEMENT SOCIETY
Dayanand Adarsh Vidyalaya,3430371,JHARKHAND,BOKARO,"Dayanand Adarsh Vidyalaya, P.O - Koriya, P.S - Chandankiyari, Jharkhand",828134,,"06542-234012 ,",,,Davkoriya1@gmail.com,,2010,2/4/2010 12:00:00 AM,MR. SATYENDRA KUMAR OJHA,1,"M.A., B.Ed.",6,8,Secondary School,Provisional,1/4/2018,31/3/2021,The Oxford Learning Campus
delhi public school,3430044,JHARKHAND,BOKARO,sect iv boko steel city distt bokaro jharkhand,827004,6542,"233544 , 242287",06542-232222,243015,bko.hsm@gmail.com,http://www.dpsbokaro.com,1987,7/7/2003 12:00:00 AM,Awanindra Singh Gangwar,0,,,,Senior Secondary,Provisional,1/4/2014,31/ 3/ 2019,delhi public school society
"DELHI PUBLIC SCHOOL, CHAS",3430369,JHARKHAND,BOKARO,CHANDANKYARI ROAD,827013,,"9204060521 ,",,,rao.krishnadlj@gmail.com,http://www.dpschasbokaro.com,2017,4/10/2017 12:00:00 AM,Mr.K KRISHNA RAO,,"M.COM., B.ED",20,32,Secondary School,Provisional,1/4/2018,31/3/2021,DURGA DEVI SHIVNARAYAN MEMORIAL SOCIETY
GAURAV AWASIYA UCHYA VIDALAY,3430344,JHARKHAND,BOKARO,"BANSHIIH,CHAS,",827013,6542,"265211 ,",,06542-268455,bkscbhu@rediffmail.com,,2008,1/1/2008 12:00:00 AM,BINAY KUMAR SINGH CHOUDHARY,0,"M.A, B.Ed,LLB",15,5,Secondary School,Provisional,1/4/2017,31/3/2020,GOURAV AWASIYA PRABANDH SAMITI
GURU GOBIND SINGH PUBLIC SCHOOL,3430208,JHARKHAND,BOKARO,"JODADIH MORE, CHAS BOKARO STEEL CITY CHAS, DISTT BOKARO JHARKHAND",827013,6542,"265655 ,",,0651 2530690,ggpschas@rediffmail.com,http://www.taurianworldschool.com,2008,4/15/2008 12:00:00 AM,JOSE THOMAS,2,"M.A., B.Sc. (Hons.)",9,33,Senior Secondary,Provisional,1/4/2014,31/ 3/ 2019,Al Irshad Charitable Society Omassery
GURU GOVIND SINGH PUBLIC SCHOOL,3430040,JHARKHAND,BOKARO,SECTOR V BOKARO STEEL CITY BOKARO JHARKHAND,827006,6542,"268589 ,",7209563315,,dey.subhodip@yahoo.com,,1980,7/1/2005 12:00:00 AM,SUBHODIP DEY,0,,,,Senior Secondary,Provisional,1/4/2015,31/ 3/ 2020,GURU GOBIND SINGH EDUCATIONA SOCY
holy cross school,3430012,JHARKHAND,BOKARO,bokaro steel city bokaro distt jharkhand,827010,6542,"253543 ,",06542-253723,6542253007,srkamalapaulhc@gmail.com,www.holycrossbokaro.com,1974,7/1/2005 12:00:00 AM,SR KAMALA PAUL BIHARI,2,msc maths,11,20,Senior Secondary,Provisional,1/4/2014,31/ 3/ 2019,holy cross society
Holy Cross School,3430283,JHARKHAND,BOKARO,"Chandankiyari, Bokaro p.o-chandankiyari ,pin-828124 dist-Bokaro, state-Jharkhand",828124,6542,"9279743663 ,",,,simonkiran@gmail.com,,2004,7/13/2004 12:00:00 AM,Kirthi Kiran,0,"M.A,BED",32,25,Senior Secondary,Provisional,1/4/2018,31/ 3/ 2023,HOLY CROSS INSTITUTE
JAWAHAR NAVODAYA VIDYALAYA,3440010,JHARKHAND,BOKARO,AT & PO TENUGHAT NO.1 DISTT BOKARO JHARKHAND,829123,6549,"230611 ,",3110,,udayprakashsingh1962@gmail.com,,1984,4/1/1991 12:00:00 AM,UDAY PRAKASH SINGH,0,,,,Senior Secondary,Provisional,1/4/2014,31/ 3/ 2024,Navodaya Vidyalaya Samiti
KASTURBA SHREE VIDYA NIKETAN,3430073,JHARKHAND,BOKARO,(GIRLS HIGH SCHOOL) P O DHORI DISTT BOKARO JHARKHAND,825102,6549,"220495 ,",221145,220055,srvastavam18@gmail.com,www.ksvndhori.org,1991,8/12/2007 12:00:00 AM,MAMTA SRIVASTAVA,2,B.Sc.Hons:M.A.B.Ed.,13,23,Secondary School,Provisional,1/4/2018,31/3/2019,RAMARPAN SOCIETY N C GAUR
KENDRIYA VIDYALAYA,3400015,JHARKHAND,BOKARO,D V C BOKARO THERMAL BOKARO DISTT JHARKHAND,829107,6549,"266785 ,",298,2466171,dkumarkvs@gmail.com,http://www.kv2kota.org,1986,4/1/2005 12:00:00 AM,DINESH KUMAR,1,M. Sc.,03,30,Senior Secondary,Provisional,1/4/2019,31/ 3/ 2024,KENDRIYA VIDYALAYA SANGATHAN
KENDRIYA VIDYALAYA,3400023,JHARKHAND,BOKARO,DUGDA COAL WASHERY P.O. DUGDA DISTT. BOKARO JHARKHAND,828404,0326,"P&T 227 , LOC 12",12,,helpdesk@xeenet.xeedhn.xeemail.com,,1988,,MR N C MANI,0,,,,Senior Secondary,Provisional,1/4/1995,31/ 3/ 2001,KENDRIYA VIDYALAYA SANGATHAN
KENDRIYA VIDYALAYA,3400010,JHARKHAND,BOKARO,CHANDRAPURA THERMAL POWER STATION CHANDRAPURA P O CHANDRAPURA BOKARO DISTT JHARKHAND,825303,6549,"242259 ,",06549-242439,,kvchandrapura@yahoo.co.in,,1983,,Anjani Asha Salkar,1,"M.A.,M.ED",05,32,Senior Secondary,Provisional,1/4/2018,31/ 3/ 2022,KENDRIYA VIDYALAYA SANGATHAN
KENDRIYA VIDYALAYA NO 1,3400001,JHARKHAND,BOKARO,SECTOR 4 BOKARO STEEL CITY BOKARO JHARKHAND,827004,0654,"2231207 ,",6282,,odilminz@gmail.com,,1967,4/1/1991 12:00:00 AM,ODIL SUSHILA MINZ,0,,,,Senior Secondary,Provisional,1/4/2018,31/ 3/ 2023,KENDRIYA VIDYALAYA SANGATHAN
KENDRIYA VIDYALAYA NO 3,3400021,JHARKHAND,BOKARO,RAILWAY COLONY BOKARO STEEL CITY JHARKHAND,827010,6542,"253694 ,",06542253694,0654225369,mmardi17@gmail.com,www.kv3bokaro.org,1983,2/27/2018 12:00:00 AM,MAISA MARDI,1,M.Com,5,15,Senior Secondary,Provisional,1/4/2018,31/ 3/ 2020,KENDRIYA VIDYALAYA SANGATHAN
KRISHNA SUDERSHAN CENTRAL SCHOOL,3430180,JHARKHAND,BOKARO,KHAS MAHAL CCL PO SUNDAY BAZAR BERMO DISTT BOKARO JHARKHAND,829127,6549,"260260 ,",06549-260260,,singhmamta389@gmail.com,,2003,6/1/2015 12:00:00 AM,MAMTA SINGH,1,"M.Sc., M.Ed., Ph.D.",10,20,Senior Secondary,Provisional,1/4/2018,31/ 3/ 2023,DR Y K SUDERSHAN EDU FOUNDATION
LEELA JANKI PUBLIC SCHOOL,3430298,JHARKHAND,BOKARO,"RAGHUNATHPURAM, PETARWAR",829121,6549,"265055 ,",,,contact@leelajankipublicschool.com,,2000,4/7/2000 12:00:00 AM,SWARN LATA,0,M.SC/B.ED,10,10,Secondary School,Provisional,1/4/2017,31/3/2022,LEELA JANKI SEVA SANSTHAN
"LOYOLA ENGLISH MEDIUM SCHOOL, GOMIA",3430339,JHARKHAND,BOKARO,"I.E. GOMIA-PO, BOKARO-DT",829112,,"06544261125 ,",,,loyolapacyla@gmail.com,,2009,1/4/2009 12:00:00 AM,MissGLIGY SEBASTIAN,,M.A. B.ED.,5,8,Secondary School,Provisional,1/4/2016,31/3/2019,Hazaribag Catholic Diocese
MGM HIGHER SECONDARY SCHOOL,3430093,JHARKHAND,BOKARO,SECTOR IV F BOKARO STEEL CITY JHARKHAND,827004,6542,"269783 ,",06542-270148,270253,rcv68@rediffmail.com,,1988,7/1/2005 12:00:00 AM,Fr Reji C Varghese,1,M.A. B.Ed,12,21,Senior Secondary,Provisional,1/4/2015,31/ 3/ 2020,THE CALCUTTA ORTHODOX DIOCESAN COUNCIL
Mithila Academy Public School,3430263,JHARKHAND,BOKARO,"Sector 4E, B.S.City, Bokaro Distt., Jharkhand",827004,6542,"7033859521 ,",9915070521,,sreelalall2016@gmail.com,,1990,4/16/1990 12:00:00 AM,SREELA LALL,2,"MA,P.hd,B.Ed,AMIBM,NET",17,20,Senior Secondary,Provisional,1/4/2017,31/ 3/ 2020,Mithila Sanskritk parishad
Mount Sion School,3430376,JHARKHAND,BOKARO,Sector - XII/D,827012,,"06542-255077 ,",,,mountsionschool@yahoo.in,http://www.mountsionschool.com,2001,6/25/2001 12:00:00 AM,Dr.Bindu Reena Thakur,,"Graduate, B.ed (Result awaitng) ,",15,15,Secondary School,Provisional,1/4/2018,31/3/2021,Sion Ministries
PANDIT BAGESHWARI PANDEY SARASWATI,3430129,JHARKHAND,BOKARO,VIDYA MANDIR DEV NAGAR P.O. DUGDHA DISTT. BOKARO JHARKHAND- 828404,828404,6549,"244078 ,",9430373848,06549-2210,svmandir.saraswatividyamandir@gmail.com,,1980,7/1/2005 12:00:00 AM,RAJENDRA MAHAPATRA,1,"M.A.PHD,B.Ed.",11,25,Senior Secondary,Provisional,1/4/2014,31/ 3/ 2019,BALL KALYAN SAMITI DUGDHA
PITTS MODERN SCHOOL,3430014,JHARKHAND,BOKARO,GOMIA P O INDIAN EXPLOSIVES (GOMIA) BOKARO DISTT JHARKHAND,829112,6544,"261595 ,","261625,",9470598443,manojkrup05@gmail.com,www.pittsmodernschool.co.,1968,4/1/2005 12:00:00 AM,MANOJ KUMAR UPADHYAY,1,"M.Sc.,B.Ed.",10,20,Senior Secondary,Provisional,1/4/2019,31/ 3/ 2020,GOMIA SCHOOL SOCIETY
Rainbow Public School,3430308,JHARKHAND,BOKARO,"Chira Chas , P.O. - Jamgoraia, P.S. - Chas , B.S.CITY",827013,6542,"251050 ,",,,shankarsharmarps2015@gmail.com,,2006,4/7/2006 12:00:00 AM,SHANKAR SHARMA,0,"M.A. , B.Ed.",7,10,Senior Secondary,Provisional,1/4/2017,31/ 3/ 2020,K.D.S. Educational Welfare Society
Rukmini Devi Public School,3430341,JHARKHAND,BOKARO,phusro,829144,6549,"222534 ,",,,rdpsphusro@gmail.com,http://www.rdps.org.in,1999,3/26/1999 12:00:00 AM,Geeta Bharti,,"B.A, B ed",6,7,Secondary School,Provisional,1/4/2016,31/3/2019,Rukmini Devi Educational and cultural Society
SARASWATI SHISHU VIDYA MANDIR,3430190,JHARKHAND,BOKARO,9-D SEC IX B ROAD NEAR POST OFFICE BOKARO STEEL CITY JHARKHAND,827009,6542,"262770 ,",,,jraghavkumar@gmail.com,,2007,8/12/2007 12:00:00 AM,RAGHAV KUMAR JHA,0,,,,Senior Secondary,Provisional,1/4/2017,31/ 3/ 2022,BHARTIYA SANSKRITI GYAN MANDIR TR
SARASWATI VIDYA MANDIR,3430022,JHARKHAND,BOKARO,SECTOR III-C BOKARO STEEL CITY BOKARO DHANBAD JHARKHAND,827001,6542,"247579 , 7579",06542221646,,mrityunjoysahay9876@gmail.com,,1967,7/1/2005 12:00:00 AM,MRITYUNJOY SAHAY,1,M.A B.Ed,25,30,Senior Secondary,Provisional,1/4/2015,31/ 3/ 2020,SHISHU SHIKSHA PRABANDH SAMITI
SARDAR PATEL PUBLIC SCHOOL,3430138,JHARKHAND,BOKARO,SEC-IX A B. ROAD BOKARO STEEL CITY JHARKHAND,827009,6542,"261369 , -",27857029,,amar.hcr@gmail.com,,1985,4/1/1991 12:00:00 AM,AMAR PRASAD,1,"m.sc, m.ed",03,21,Senior Secondary,Provisional,1/4/2015,31/ 3/ 2020,THE PATEL SEVA SANGH BIHAR
south eastern railway inter college,3480008,JHARKHAND,BOKARO,"bhojudih, at & po, bhojudih, ps-chandan kiyari, distt. bokaro, jharkhand`",828303,0654,"2230011 ,",2557,,mayankkrawat650@gmail.com,,1963,4/1/1991 12:00:00 AM,RAJESH KUMAR,0,"m.a.(eco), b,ed",,,Senior Secondary,Provisional,1/4/2019,31/ 3/ 2022,board of governs sainik school
SREE AYYAPPA PUBLIC SCHOOL,3430112,JHARKHAND,BOKARO,SECTOR V D BOKARO STEEL CITY JHARKHAND,827006,0654,"266491 ,",09234460605,6542269300,principal@ayyappachool.in,www.ayyappaschool.in,1988,1/14/2000 12:00:00 AM,Dr Letha Mohanan,2,"M.Sc. , MPHIL",12,27,Senior Secondary,Provisional,1/4/2015,31/ 3/ 2020,AYYAPPA SEVA SANGHAM SOCIETY
ST.PAULS MODERN SCHOOL,3430267,JHARKHAND,BOKARO,BOKARO THERMAL,829107,6549,"266755 ,",,06549266755,sureshgaikwad100@gmail.com,,1984,1/25/1984 12:00:00 AM,SURESH GAIKWAD,0,"BA,M.ED.",24,24,Secondary School,Provisional,1/4/2015,31/3/2020,"The Society of St. Paul For Educational,Social and Career Development"
VINAY INTERNATIONAL SCHOOL,3430358,JHARKHAND,BOKARO,"Jainamore, Bokaro",829301,,"9470561085 ,",,,vinayischool@gmail.com,,2015,4/30/2015 12:00:00 AM,Mr.Sanjay Kumar Singh,0,MA/BEd,02,05,Secondary School,Provisional,1/4/2017,31/3/2020,Vivekanand Charitable Trust
WETGE PUBLIC SCHOOL,3430204,JHARKHAND,BOKARO,KSP PHASE II BOKHARO THERMAL BOKARO JHARKHAND,829107,6549,"266093 ,",,0294-2440014,namitasinha42@gmail.com,http://www.wittykidsindia.com,2003,4/9/2009 12:00:00 AM,NAMITA SINHA,0,"M.Phil., M.Sc., B.Ed.",13,15,Senior Secondary,Provisional,1/4/2015,31/ 3/ 2020,SOCIETY FOR WELFARE TEACHERS & GOVT EMPLOYEES
D A V PUBLIC SCHOOL,3430280,JHARKHAND,CHATRA,"GAYA ROAD, BABHNE",825401,6541,"254578 ,",,06541-225478,syedejazahmed66@gmail.com,http://www.puritydavchatra.in,2008,4/23/2008 12:00:00 AM,SYED EJAZ AHMED,0,"M.Sc. ,B.Ed.",12,20,Secondary School,Provisional,1/4/2016,31/3/2021,DAV COLLEGE TRUST & MANAGEMENT SOCIETY
DAV PUBLIC SCHOOL,3430185,JHARKHAND,CHATRA,SUR VIHAR COLONY PIPARWAR AREA CCL PO BACHRA DISTT CHATRA JHARKHAND,829201,6531,"260376 , 260580",06531-260580,260376,davrajeevranjan@gmail.com,www davbachra.org,2007,8/12/2007 12:00:00 AM,RAJEEV RANJAN JHA,1,"M.A, B.ED",27,28,Senior Secondary,Provisional,1/4/2017,31/ 3/ 2022,DAV COLLEGE TRUST AND MGMT SOCIETY
JAWAHAR NAVODAYA VIDYALAYA,3440011,JHARKHAND,CHATRA,P O CHATRA CHATRA DISTT. JHARKHAND,825401,,"7079294105 ,",,,jnvchatra2@gmail.com,,1993,3/31/2012 12:00:00 AM,DAVESH NARAYAN,0,,,,Senior Secondary,Provisional,1/4/2019,31/ 3/ 2024,NAVODAYA VIDYALAYA SAMITI
Nazareth School,3430303,JHARKHAND,CHATRA,Chatra,825401,6541,"224620 ,",4482766,06541224620,studu@yahoo.com,,2005,4/1/2005 12:00:00 AM,SUSANA TUDU,2,"MA, B.Ed.",11,15,Secondary School,Provisional,1/4/2017,31/3/2022,Sisters of Charity of Nazareth
ANANDALAYA PUBLIC SCHOOL,3430220,JHARKHAND,deoghar,"JAGDISHPUR, MODHUPUR, DEOGARH, JHARKHAND",815353,6438,"284210 ,",9915070521,0183-2700808,aniruddh.mishra69@gmail.com,,2003,3/4/2003 12:00:00 AM,ANIRUDDH MISHRA,1,"M.A, B.Ed",02,20,Secondary School,Provisional,1/4/2014,31/3/2019,ST.XAVIERS EDUCATION TRUST
devsangha national school,3430126,JHARKHAND,deoghar,p.o. devsangha bompas town b. deoghar jharkhand,814114,6432,"292205 ,",,,dsnsdeoghar@gmail.com,www.dsnsonline.edu.in,1996,4/4/2006 12:00:00 AM,PANKAJ KUMAR,0,b. ed.,1,5,Senior Secondary,Provisional,1/4/2014,31/ 3/ 2019,dev sangha pratisthan
GEETA DEVI DAV PUBLIC SCHOOL,3430162,JHARKHAND,deoghar,BHANDAR KOLA SATAR ROAD B DEOGHAR JHARKHAND,814112,6432,"292286 ,",222534,,pplramesh@rediffmail.com,,1996,8/12/2007 12:00:00 AM,RAMESH CHANDRA SHARMA,1,"MAENG. HN,B.ED, Ph.D",11,17,Senior Secondary,Provisional,1/4/2018,31/ 3/ 2019,DAV COLLEGE TRUST & MGMT SOCIETY
INDIAN HERITAGE SCHOOL,3430285,JHARKHAND,deoghar,"MITRA GARDEN ROHINI ROAD JASIDIH,DEOGHAR, JHARKHAND",814142,6432,"291961 ,",,,indianheritageschooldeoghar@gmail.com,http://www.indianheritageschool.webs.com,2004,4/16/2004 12:00:00 AM,MOON GUPTA,1,"M.A,M.ED",8,10,Senior Secondary,Provisional,1/4/2016,31/ 3/ 2019,Shree Shambhu memorial educational society
Jasidih Public School,3430284,JHARKHAND,deoghar,"Near Pagal Baba Ashram, Rohini Road, Jasidih, Deoghar, Jharkhand",814142,6432,"9204209631 ,",,,MAIL@JASIDIHPUBLICSCHOOL.COM,,2001,2/4/2001 12:00:00 AM,BHARTENDU,0,"M.Sc, B.Ed, Ph.D",10,15,Secondary School,Provisional,1/4/2016,31/3/2018,Bal Kalyan Trust
JAWAHAR NAVODAYA VIDYALAYA,3440013,JHARKHAND,deoghar,RIKHIYA DISTT. DEOGHAR JHARKHAND-814113,814113,0643,"290745 ,",290745,,dubey_1963@rediffmail.com,,1993,3/31/2011 12:00:00 AM,S K DUBEY,0,,,,Senior Secondary,Provisional,1/4/2012,31/ 3/ 2020,Navodaya Vidyalaya Samiti
KENDRIYA VIDYALAYA,3400035,JHARKHAND,deoghar,"MADHUPUR, DISTT. DEOGHAR, JHARKHAND",815353,0634,"241200 ,",,,apmishra642@gmail.com,,1998,4/1/1991 12:00:00 AM,ANIRUDDHA PRASAD MISHRA,0,,,,Senior Secondary,Provisional,1/4/2016,31/ 3/ 2021,KENDRIYA VIDYALAYA SANGATHAN
MAHENDRA MUNI SARASWATI,3430136,JHARKHAND,deoghar,SHISHU VIDYA MANDIR MADHUPUR COLLEGE ROAD MADHUPUR DISTT. DEOGHAR JHARKHAND,815353,6438,"224085 ,",9430755435,,vishwakarma.ssvm@gmail.com,www.mmssvmandir.com,1978,6/4/2007 12:00:00 AM,GOPAL MISTRY VISHWAKARMA,1,"M.A., B.Ed, M. Com",18,25,Senior Secondary,Provisional,1/4/2017,31/ 3/ 2022,SHISHU SHIKSHA PRABANDH SAMITI BIHA
MISHRAS RESIDENTIAL PUBLIC SCHOOL,3430332,JHARKHAND,deoghar,NANDAN PAHAR B.DEOGHAR,814112,6432,"06432232647, ,",,,mrps.deoghar@gmail.com,,1996,4/15/1997 12:00:00 AM,MRS.SUDHA PANDEY,1,"M.A., B.Ed",10,16,Senior Secondary,Provisional,1/4/2018,31/ 3/ 2021,Mishras Educational Development Foundation Trust
MODERN PUBLIC SCHOOL,3430118,JHARKHAND,deoghar,CASTER'S TOWN B DEOGHAR DISTT DEOGHAR JHARKHAND,814112,06432,"222924 ,",06432222924,,sagar2007@yahoo.co.in,,1996,,Mr. MRS. KRISHNA DUTTA,2,M.A. B.Ed.,4,11,Secondary School,Provisional,1/4/2004,31/3/2008,MODERN PUBLIC SCHOOL DEOGARH
MODERN PUBLIC SCHOOL,3430356,JHARKHAND,deoghar,"SARSA, DEOGHAR",814142,6432,"292926 ,",,,mps.deoghar2012@gmail.com,,1981,1/1/1981 12:00:00 AM,ASHA SINHA,,"M.A., B.Ed",5,10,Secondary School,Provisional,1/4/2017,31/3/2020,MODERN PUBLIC SCHOOL PRABANDH SAMITI
mothers international academy,3430260,JHARKHAND,deoghar,"panch mandir road, Madhupur, Deogarh,",815353,6438,"220008 ,",,,milansaraf@ymail.com,,1999,9/6/1999 12:00:00 AM,MILAN SARAF,0,"b.sc. hons, b.ed.",8,23,Senior Secondary,Provisional,1/4/2014,31/ 3/ 2017,sarita memial charitable trust
Mount Litera Zee School,3430287,JHARKHAND,deoghar,"Vill:Rikhia, Block: Mohanpur",814112,6432,"222095 ,",,06432-240065,mohankp48@gmail.com,http://www.zeeschooldeoghar.com,2012,4/2/2013 12:00:00 AM,MOHAN K P,0,"M.A.(Eng),B.Ed.",5,12,Senior Secondary,Provisional,1/4/2016,31/ 3/ 2019,shivam educational society(regd.)
nalanda academy,3430256,JHARKHAND,deoghar,52 bigha s.n.bose rd. madhupur deoghar jharkhand,815353,6438,"9431908755 ,",,,nalandacademy@gmail.com,,2003,5/2/2003 12:00:00 AM,PURUSHOTTAM MISHRA,0,,,,Secondary School,Provisional,1/4/2014,31/3/2019,Somwari Devi Charity Trust
RAMAKRISHNA MISSION VIDYAPITH,3430001,JHARKHAND,deoghar,P O VIDYAPEETH RAMAKRISHNA NAGAR DEOGHAR (S P) JHARKHAND,814112,6432,"222413 ,",2413,02624 220138,divyasudhananda@gmail.com,,1922,1/1/1940 12:00:00 AM,SWAMI DIVYASUDHANANDA,0,M Sc. B. Ed,3,30,Senior Secondary,Provisional,1/4/2013,31/ 3/ 2018,RAMAKRISHNA MISSION
